index,line_nos,transcript_file,audio_file,transcript,tokens
line 5 corpus_12.txt,line 5,corpus_12.txt,200703-071311_yor_7f4_elicit_4.wav,"Kò ní dúró dáadáa nígbà tóo bá kọ́kọ́ gùn ún yẹn , bẹ́ẹ̀ náà ló sì máa rí nígbà tóo bá ń sọ̀ kalẹ̀ bọ̀ lẹ́yìn tóo ti tú u lókè . ## That first climb will not be secure , and neither will the last , when you climb down after untying it from the top .","[10, 32, 13, 31, 3, 35, 17, 33, 3, 27, 0, 3, 27, 0, 13, 31, 6, 1, 26, 19, 33, 14, 1, 27, 10, 41, 10, 41, 6, 34, 13, 35, 13, 24, 40, 13, 1, 40, 40, 13, 27, 26, 11, 33, 18, 30, 12, 27, 0, 17, 31, 13, 31, 6, 1, 26, 19, 33, 14, 1, 27, 36, 18, 41, 10, 0, 11, 40, 1, 41, 11, 40, 24, 30, 13, 19, 33, 14, 19, 8, 19, 35, 20, 11, 33, 10, 28, 19, 7, 0, 19, 5, 8, 17, 18, 19, 2, 11, 8, 12, 1, 22, 8, 11, 11, 13, 14, 19, 1, 4, 18, 4, 2, 20, 17, 4, 0, 13, 3, 13, 4, 8, 19, 7, 4, 17, 22, 8, 11, 11, 19, 7, 4, 11, 0, 18, 19, 22, 7, 4, 13, 24, 14, 20, 2, 11, 8, 12, 1, 3, 14, 22, 13, 0, 5, 19, 4, 17, 20, 13, 19, 24, 8, 13, 6, 8, 19, 5, 17, 14, 12, 19, 7, 4, 19, 14, 15]"
line 6 corpus_12.txt,line 6,corpus_12.txt,200703-071311_yor_7f4_elicit_5.wav,"Kí o má bàa já bọ́ ní ìgbà àkọ́kọ́ yẹn àtìgbà tóo bá ń sọ̀ kalẹ̀ , jẹ́ kí ẹnì kan bá ẹ dì í mú nísàlẹ̀ nígbà tóo bá ń gùn ún , tàbí tóo bá ń sọ̀ . ## To make the first and last climbs safer , have an assistant hold the ladder at its base while you climb .","[10, 31, 14, 12, 27, 1, 26, 0, 9, 27, 1, 41, 13, 31, 30, 6, 1, 26, 26, 10, 41, 10, 41, 24, 40, 13, 26, 19, 30, 6, 1, 26, 19, 33, 14, 1, 27, 36, 18, 41, 10, 0, 11, 40, 9, 40, 10, 31, 40, 13, 30, 10, 0, 13, 1, 27, 40, 3, 30, 31, 12, 35, 13, 31, 18, 26, 11, 40, 13, 31, 6, 1, 26, 19, 33, 14, 1, 27, 36, 6, 34, 13, 35, 13, 19, 26, 1, 31, 19, 33, 14, 1, 27, 36, 18, 41, 19, 14, 12, 0, 10, 4, 19, 7, 4, 5, 8, 17, 18, 19, 0, 13, 3, 11, 0, 18, 19, 2, 11, 8, 12, 1, 18, 18, 0, 5, 4, 17, 7, 0, 21, 4, 0, 13, 0, 18, 18, 8, 18, 19, 0, 13, 19, 7, 14, 11, 3, 19, 7, 4, 11, 0, 3, 3, 4, 17, 0, 19, 8, 19, 18, 1, 0, 18, 4, 22, 7, 8, 11, 4, 24, 14, 20, 2, 11, 8, 12, 1]"
line 7 corpus_12.txt,line 7,corpus_12.txt,200703-071311_yor_7f4_elicit_6.wav,"Àmọ́ o , èyí lè ṣiṣẹ́ kìkì bí àkàbà náà ò bá gùn ju nǹkan bí mítà márùn - ún lọ . ## However , this is only effective when the ladder is not longer than about 15 feet [ 5 m ] .","[26, 12, 41, 14, 28, 24, 31, 11, 28, 39, 8, 39, 40, 10, 30, 10, 30, 1, 31, 26, 10, 26, 1, 26, 13, 27, 26, 32, 1, 27, 6, 34, 13, 9, 20, 13, 37, 10, 0, 13, 1, 31, 12, 31, 19, 26, 12, 27, 17, 34, 13, 35, 13, 11, 41, 7, 14, 22, 4, 21, 4, 17, 19, 7, 8, 18, 8, 18, 14, 13, 11, 24, 4, 5, 5, 4, 2, 19, 8, 21, 4, 22, 7, 4, 13, 19, 7, 4, 11, 0, 3, 3, 4, 17, 8, 18, 13, 14, 19, 11, 14, 13, 6, 4, 17, 19, 7, 0, 13, 0, 1, 14, 20, 19, 5, 4, 4, 19, 12]"
line 8 corpus_12.txt,line 8,corpus_12.txt,200703-071311_yor_7f4_elicit_7.wav,"Bí ilẹ̀ iwájú ilé bá da gẹ̀rẹ́gẹ̀rẹ́ , gbé ohun kan tó wúwo sísàlẹ̀ àkàbà tàbí kí o de ìdásẹ̀lé ìsàlẹ̀ mọ́ nǹkan kan . ## If the ground slopes away from the building , place something heavy at the base of the ladder or tie a lower rung to a fixture .","[1, 31, 8, 11, 40, 8, 22, 27, 9, 35, 8, 11, 29, 1, 27, 3, 0, 6, 40, 17, 40, 6, 40, 17, 40, 6, 1, 29, 14, 7, 20, 13, 10, 0, 13, 19, 33, 22, 35, 22, 14, 18, 31, 18, 26, 11, 40, 26, 10, 26, 1, 26, 19, 26, 1, 31, 10, 31, 14, 3, 4, 30, 3, 27, 18, 40, 11, 29, 30, 18, 26, 11, 40, 12, 41, 13, 37, 10, 0, 13, 10, 0, 13, 8, 5, 19, 7, 4, 6, 17, 14, 20, 13, 3, 18, 11, 14, 15, 4, 18, 0, 22, 0, 24, 5, 17, 14, 12, 19, 7, 4, 1, 20, 8, 11, 3, 8, 13, 6, 15, 11, 0, 2, 4, 18, 14, 12, 4, 19, 7, 8, 13, 6, 7, 4, 0, 21, 24, 0, 19, 19, 7, 4, 1, 0, 18, 4, 14, 5, 19, 7, 4, 11, 0, 3, 3, 4, 17, 14, 17, 19, 8, 4, 0, 11, 14, 22, 4, 17, 17, 20, 13, 6, 19, 14, 0, 5, 8, 23, 19, 20, 17, 4]"
line 9 corpus_12.txt,line 9,corpus_12.txt,200703-071311_yor_7f4_elicit_8.wav,"Bí ilẹ̀ bá rí págunpàgun ṣùgbọ́n tó le , fi nǹkan há a kí àkàbà náà lè rẹ́sẹ̀ dúró nílẹ̀ . ## If the ground is uneven but solid , use a wedge to get a level base .","[1, 31, 8, 11, 40, 1, 27, 17, 31, 15, 27, 6, 20, 13, 15, 26, 6, 20, 13, 39, 34, 6, 1, 41, 13, 19, 33, 11, 4, 5, 8, 13, 37, 10, 0, 13, 7, 27, 0, 10, 31, 26, 10, 26, 1, 26, 13, 27, 26, 11, 28, 17, 40, 18, 40, 3, 35, 17, 33, 13, 31, 11, 40, 8, 5, 19, 7, 4, 6, 17, 14, 20, 13, 3, 8, 18, 20, 13, 4, 21, 4, 13, 1, 20, 19, 18, 14, 11, 8, 3, 20, 18, 4, 0, 22, 4, 3, 6, 4, 19, 14, 6, 4, 19, 0, 11, 4, 21, 4, 11, 1, 0, 18, 4]"
line 10 corpus_12.txt,line 10,corpus_12.txt,200703-071311_yor_7f4_elicit_9.wav,Wá pákó pẹrẹsẹ tàbí irú nǹkan bẹ́ẹ̀ tó ṣeé gbé nǹkan lé bí ilẹ̀ ibẹ̀ bá rọ̀ jù tàbí bó bá jẹ́ àwọn nǹkan bíi fùlùfúlù ló wà nílẹ̀ ibẹ̀ . ## Provide a wooden board or something similar to make a firm base if the ground is soft or of loose material .,"[22, 27, 15, 27, 10, 33, 15, 40, 17, 40, 18, 40, 19, 26, 1, 31, 8, 17, 35, 13, 37, 10, 0, 13, 1, 40, 40, 19, 33, 39, 4, 29, 6, 1, 29, 13, 37, 10, 0, 13, 11, 29, 1, 31, 8, 11, 40, 8, 1, 40, 1, 27, 17, 41, 9, 34, 19, 26, 1, 31, 1, 33, 1, 27, 9, 40, 26, 22, 41, 13, 13, 37, 10, 0, 13, 1, 31, 8, 5, 34, 11, 34, 5, 35, 11, 34, 11, 33, 22, 26, 13, 31, 11, 40, 8, 1, 40, 15, 17, 14, 21, 8, 3, 4, 0, 22, 14, 14, 3, 4, 13, 1, 14, 0, 17, 3, 14, 17, 18, 14, 12, 4, 19, 7, 8, 13, 6, 18, 8, 12, 8, 11, 0, 17, 19, 14, 12, 0, 10, 4, 0, 5, 8, 17, 12, 1, 0, 18, 4, 8, 5, 19, 7, 4, 6, 17, 14, 20, 13, 3, 8, 18, 18, 14, 5, 19, 14, 17, 14, 5, 11, 14, 14, 18, 4, 12, 0, 19, 4, 17, 8, 0, 11]"
line 11 corpus_12.txt,line 11,corpus_12.txt,200703-071311_yor_7f4_elicit_10.wav,"Bó bá ṣe pé àkàbà ẹlẹ́sẹ̀ mẹ́rin lo fẹ́ lò , rí i dájú pé gbogbo ẹsẹ̀ rẹ̀ mẹ́rẹ̀ẹ̀rin ló dúró dáadaá nílẹ̀ , tí ìhà méjèèjì dúró wandi , tí irin àárín wọn sì nà tán . ## If you use a stepladder , make sure that all four feet are firmly on the ground , with the two sections fully apart and any safety catches locked in place .","[1, 33, 1, 27, 39, 4, 15, 29, 26, 10, 26, 1, 26, 40, 11, 40, 18, 40, 12, 40, 17, 8, 13, 11, 14, 5, 40, 11, 32, 17, 31, 8, 3, 27, 9, 35, 15, 29, 6, 1, 14, 6, 1, 14, 40, 18, 40, 17, 40, 12, 40, 17, 40, 40, 17, 8, 13, 11, 33, 3, 35, 17, 33, 3, 27, 0, 3, 0, 27, 13, 31, 11, 40, 19, 31, 30, 7, 26, 12, 29, 9, 28, 28, 9, 30, 3, 35, 17, 33, 22, 0, 13, 3, 8, 19, 31, 8, 17, 8, 13, 26, 27, 17, 31, 13, 22, 41, 13, 18, 30, 13, 26, 19, 27, 13, 8, 5, 24, 14, 20, 20, 18, 4, 0, 18, 19, 4, 15, 11, 0, 3, 3, 4, 17, 12, 0, 10, 4, 18, 20, 17, 4, 19, 7, 0, 19, 0, 11, 11, 5, 14, 20, 17, 5, 4, 4, 19, 0, 17, 4, 5, 8, 17, 12, 11, 24, 14, 13, 19, 7, 4, 6, 17, 14, 20, 13, 3, 22, 8, 19, 7, 19, 7, 4, 19, 22, 14, 18, 4, 2, 19, 8, 14, 13, 18, 5, 20, 11, 11, 24, 0, 15, 0, 17, 19, 0, 13, 3, 0, 13, 24, 18, 0, 5, 4, 19, 24, 2, 0, 19, 2, 7, 4, 18, 11, 14, 2, 10, 4, 3, 8, 13, 15, 11, 0, 2, 4]"
line 12 corpus_12.txt,line 12,corpus_12.txt,200703-071311_yor_7f4_elicit_11.wav,Ṣé Ẹ̀mí Ẹ Dè ? ## Are You Safe ?,"[39, 29, 40, 12, 31, 40, 3, 28, 0, 17, 4, 24, 14, 20, 18, 0, 5, 4]"
line 13 corpus_12.txt,line 13,corpus_12.txt,200703-071311_yor_7f4_elicit_12.wav,6 Yẹ bàtà rẹ wò . ## 6 Check your shoes .,"[24, 40, 1, 26, 19, 26, 17, 40, 22, 32, 2, 7, 4, 2, 10, 24, 14, 20, 17, 18, 7, 14, 4, 18]"
line 14 corpus_12.txt,line 14,corpus_12.txt,200703-071311_yor_7f4_elicit_13.wav,"Kóo tó gun àkàbà , rí i dájú pé kò sómi nísàlẹ̀ bàtà rẹ . ## Before you climb a ladder , make sure that the soles of your shoes are dry .","[10, 33, 14, 19, 33, 6, 20, 13, 26, 10, 26, 1, 26, 17, 31, 8, 3, 27, 9, 35, 15, 29, 10, 32, 18, 33, 12, 8, 13, 31, 18, 26, 11, 40, 1, 26, 19, 26, 17, 40, 1, 4, 5, 14, 17, 4, 24, 14, 20, 2, 11, 8, 12, 1, 0, 11, 0, 3, 3, 4, 17, 12, 0, 10, 4, 18, 20, 17, 4, 19, 7, 0, 19, 19, 7, 4, 18, 14, 11, 4, 18, 14, 5, 24, 14, 20, 17, 18, 7, 14, 4, 18, 0, 17, 4, 3, 17, 24]"
line 15 corpus_12.txt,line 15,corpus_12.txt,200703-071311_yor_7f4_elicit_14.wav,"Gbá àwọn nǹkan bí ẹrẹ̀ , tó bá lè yọ̀ ẹ́ dà nù . ## Remove anything , like mud , that might make you slip .","[6, 1, 27, 26, 22, 41, 13, 13, 37, 10, 0, 13, 1, 31, 40, 17, 40, 19, 33, 1, 27, 11, 28, 24, 41, 40, 3, 26, 13, 34, 17, 4, 12, 14, 21, 4, 0, 13, 24, 19, 7, 8, 13, 6, 11, 8, 10, 4, 12, 20, 3, 19, 7, 0, 19, 12, 8, 6, 7, 19, 12, 0, 10, 4, 24, 14, 20, 18, 11, 8, 15]"
line 16 corpus_12.txt,line 16,corpus_12.txt,200703-071311_yor_7f4_elicit_15.wav,7 Máa rọra gbé nǹkan . ## 7 Carry things carefully .,"[12, 27, 0, 17, 41, 17, 0, 6, 1, 29, 13, 37, 10, 0, 13, 2, 0, 17, 17, 24, 19, 7, 8, 13, 6, 18, 2, 0, 17, 4, 5, 20, 11, 11, 24]"
line 17 corpus_12.txt,line 17,corpus_12.txt,200703-071311_yor_7f4_elicit_16.wav,"Kí o lè ráyè fọwọ́ rẹ méjèèjì di àkàbà mú , bó bá ṣeé ṣe , kó irinṣẹ́ sínú àpò kan tó ṣeé so mọ́ ìgbànú . ## To leave both hands free for climbing , if possible , carry tools in a holder that is attached to a belt .","[10, 31, 14, 11, 28, 17, 27, 24, 28, 5, 41, 22, 41, 17, 40, 12, 29, 9, 28, 28, 9, 30, 3, 8, 26, 10, 26, 1, 26, 12, 35, 1, 33, 1, 27, 39, 4, 29, 39, 4, 10, 33, 8, 17, 8, 13, 39, 40, 18, 31, 13, 35, 26, 15, 32, 10, 0, 13, 19, 33, 39, 4, 29, 18, 14, 12, 41, 30, 6, 1, 26, 13, 35, 19, 14, 11, 4, 0, 21, 4, 1, 14, 19, 7, 7, 0, 13, 3, 18, 5, 17, 4, 4, 5, 14, 17, 2, 11, 8, 12, 1, 8, 13, 6, 8, 5, 15, 14, 18, 18, 8, 1, 11, 4, 2, 0, 17, 17, 24, 19, 14, 14, 11, 18, 8, 13, 0, 7, 14, 11, 3, 4, 17, 19, 7, 0, 19, 8, 18, 0, 19, 19, 0, 2, 7, 4, 3, 19, 14, 0, 1, 4, 11, 19]"
line 18 corpus_12.txt,line 18,corpus_12.txt,200703-071311_yor_7f4_elicit_17.wav,"Wá nǹkan míì fi gbé àwọn nǹkan tó ṣòroó gbé gun àkàbà , àmọ́ bó bá di dandan láti lo àkàbà , má ṣe yọ ọwọ́ kan tó kù kúrò lára àkàbà , ṣe ni kóo máa wọ́ ọ lára àkàbà bóo ti ń gùn ún lọ . ## Try to find alternative methods of lifting awkward objects , but if you must use a ladder , keep your free hand in contact with the ladder at all times by sliding it along the side of the ladder as you climb .","[22, 27, 13, 37, 10, 0, 13, 12, 31, 30, 5, 8, 6, 1, 29, 26, 22, 41, 13, 13, 37, 10, 0, 13, 19, 33, 39, 32, 17, 14, 33, 6, 1, 29, 6, 20, 13, 26, 10, 26, 1, 26, 26, 12, 41, 1, 33, 1, 27, 3, 8, 3, 0, 13, 3, 0, 13, 11, 27, 19, 8, 11, 14, 26, 10, 26, 1, 26, 12, 27, 39, 4, 24, 41, 41, 22, 41, 10, 0, 13, 19, 33, 10, 34, 10, 35, 17, 32, 11, 27, 17, 0, 26, 10, 26, 1, 26, 39, 4, 13, 8, 10, 33, 14, 12, 27, 0, 22, 41, 41, 11, 27, 17, 0, 26, 10, 26, 1, 26, 1, 33, 14, 19, 8, 36, 6, 34, 13, 35, 13, 11, 41, 19, 17, 24, 19, 14, 5, 8, 13, 3, 0, 11, 19, 4, 17, 13, 0, 19, 8, 21, 4, 12, 4, 19, 7, 14, 3, 18, 14, 5, 11, 8, 5, 19, 8, 13, 6, 0, 22, 10, 22, 0, 17, 3, 14, 1, 9, 4, 2, 19, 18, 1, 20, 19, 8, 5, 24, 14, 20, 12, 20, 18, 19, 20, 18, 4, 0, 11, 0, 3, 3, 4, 17, 10, 4, 4, 15, 24, 14, 20, 17, 5, 17, 4, 4, 7, 0, 13, 3, 8, 13, 2, 14, 13, 19, 0, 2, 19, 22, 8, 19, 7, 19, 7, 4, 11, 0, 3, 3, 4, 17, 0, 19, 0, 11, 11, 19, 8, 12, 4, 18, 1, 24, 18, 11, 8, 3, 8, 13, 6, 8, 19, 0, 11, 14, 13, 6, 19, 7, 4, 18, 8, 3, 4, 14, 5, 19, 7, 4, 11, 0, 3, 3, 4, 17, 0, 18, 24, 14, 20, 2, 11, 8, 12, 1]"
line 19 corpus_12.txt,line 19,corpus_12.txt,200703-071311_yor_7f4_elicit_18.wav,"Máa gbẹ́sẹ̀ lọ́kọ̀ọ̀kan , ní ṣísẹ̀ - n - tẹ̀lé , láìkánjú . ## Be deliberate and methodical , and do not rush .","[12, 27, 0, 6, 1, 40, 18, 40, 11, 41, 10, 41, 41, 10, 0, 13, 13, 31, 39, 31, 18, 40, 13, 19, 40, 11, 29, 11, 27, 30, 10, 27, 13, 9, 35, 1, 4, 3, 4, 11, 8, 1, 4, 17, 0, 19, 4, 0, 13, 3, 12, 4, 19, 7, 14, 3, 8, 2, 0, 11, 0, 13, 3, 3, 14, 13, 14, 19, 17, 20, 18, 7]"
line 20 corpus_12.txt,line 20,corpus_12.txt,200703-071311_yor_7f4_elicit_19.wav,"Bóo bá ń lo irinṣẹ́ tó ń lo iná mànàmáná , má ṣe fi ọwọ́ méjèèjì mú un dání . ## If you use electric power tools , never use both hands to operate them .","[1, 33, 14, 1, 27, 36, 11, 14, 8, 17, 8, 13, 39, 40, 19, 33, 36, 11, 14, 8, 13, 27, 12, 26, 13, 26, 12, 27, 13, 27, 12, 27, 39, 4, 5, 8, 41, 22, 41, 12, 29, 9, 28, 28, 9, 30, 12, 35, 20, 13, 3, 27, 13, 31, 8, 5, 24, 14, 20, 20, 18, 4, 4, 11, 4, 2, 19, 17, 8, 2, 15, 14, 22, 4, 17, 19, 14, 14, 11, 18, 13, 4, 21, 4, 17, 20, 18, 4, 1, 14, 19, 7, 7, 0, 13, 3, 18, 19, 14, 14, 15, 4, 17, 0, 19, 4, 19, 7, 4, 12]"
line 21 corpus_12.txt,line 21,corpus_12.txt,200703-071311_yor_7f4_elicit_20.wav,"Fún àpẹẹrẹ , ẹ̀rọ ìdá - nǹkan - lu lè ṣàdédé há tàbí kí ó yọ̀ bọ̀rọ́ , ìyẹn sì lè gbò ẹ́ , kí o sì ṣubú . ## A drill , for example , may unexpectedly jam or slip , causing you to lose your balance and fall .","[5, 35, 13, 26, 15, 40, 40, 17, 40, 40, 17, 41, 30, 3, 27, 13, 37, 10, 0, 13, 11, 20, 11, 28, 39, 26, 3, 29, 3, 29, 7, 27, 19, 26, 1, 31, 10, 31, 33, 24, 41, 1, 41, 17, 41, 30, 24, 40, 13, 18, 30, 11, 28, 6, 1, 32, 40, 10, 31, 14, 18, 30, 39, 20, 1, 35, 0, 3, 17, 8, 11, 11, 5, 14, 17, 4, 23, 0, 12, 15, 11, 4, 12, 0, 24, 20, 13, 4, 23, 15, 4, 2, 19, 4, 3, 11, 24, 9, 0, 12, 14, 17, 18, 11, 8, 15, 2, 0, 20, 18, 8, 13, 6, 24, 14, 20, 19, 14, 11, 14, 18, 4, 24, 14, 20, 17, 1, 0, 11, 0, 13, 2, 4, 0, 13, 3, 5, 0, 11, 11]"
line 22 corpus_12.txt,line 22,corpus_12.txt,200703-071311_yor_7f4_elicit_21.wav,Má ṣe yí irinṣẹ́ èyíkéyìí síbi tó ti lè máa dá ṣiṣẹ́ lọ láìdúró ; ó lè ṣèèṣì já bọ́ bóo ṣe ń lò ó lọ́wọ́ . ## Never lock them into an on mode ; they may fall while still operating .,"[12, 27, 39, 4, 24, 31, 8, 17, 8, 13, 39, 40, 28, 24, 31, 10, 29, 24, 30, 31, 18, 31, 1, 8, 19, 33, 19, 8, 11, 28, 12, 27, 0, 3, 27, 39, 8, 39, 40, 11, 41, 11, 27, 30, 3, 35, 17, 33, 33, 11, 28, 39, 28, 28, 39, 30, 9, 27, 1, 41, 1, 33, 14, 39, 4, 36, 11, 32, 33, 11, 41, 22, 41, 13, 4, 21, 4, 17, 11, 14, 2, 10, 19, 7, 4, 12, 8, 13, 19, 14, 0, 13, 14, 13, 12, 14, 3, 4, 19, 7, 4, 24, 12, 0, 24, 5, 0, 11, 11, 22, 7, 8, 11, 4, 18, 19, 8, 11, 11, 14, 15, 4, 17, 0, 19, 8, 13, 6]"
line 23 corpus_12.txt,line 23,corpus_12.txt,200703-071311_yor_7f4_elicit_22.wav,8 Máa gba tàwọn ẹlòmíì rò . ## 8 Be considerate of others .,"[12, 27, 0, 6, 1, 0, 19, 26, 22, 41, 13, 40, 11, 32, 12, 31, 30, 17, 32, 1, 4, 2, 14, 13, 18, 8, 3, 4, 17, 0, 19, 4, 14, 5, 14, 19, 7, 4, 17, 18]"
line 24 corpus_12.txt,line 24,corpus_12.txt,200703-071311_yor_7f4_elicit_23.wav,"Bó bá jẹ́ pé ibi tí gbogbo èèyàn ń gbà kọjá lo ti ń ṣiṣẹ́ , gbé àkàbà síbi tí wọ́n á ti tètè rí i , bó bá sì ṣeé ṣe , to nǹkan yí i ká . ## If you are working in a public place , make the ladder easily visible and , if possible , cordon it off .","[1, 33, 1, 27, 9, 40, 15, 29, 8, 1, 8, 19, 31, 6, 1, 14, 6, 1, 14, 28, 28, 24, 26, 13, 36, 6, 1, 26, 10, 41, 9, 27, 11, 14, 19, 8, 36, 39, 8, 39, 40, 6, 1, 29, 26, 10, 26, 1, 26, 18, 31, 1, 8, 19, 31, 22, 41, 13, 27, 19, 8, 19, 28, 19, 28, 17, 31, 8, 1, 33, 1, 27, 18, 30, 39, 4, 29, 39, 4, 19, 14, 13, 37, 10, 0, 13, 24, 31, 8, 10, 27, 8, 5, 24, 14, 20, 0, 17, 4, 22, 14, 17, 10, 8, 13, 6, 8, 13, 0, 15, 20, 1, 11, 8, 2, 15, 11, 0, 2, 4, 12, 0, 10, 4, 19, 7, 4, 11, 0, 3, 3, 4, 17, 4, 0, 18, 8, 11, 24, 21, 8, 18, 8, 1, 11, 4, 0, 13, 3, 8, 5, 15, 14, 18, 18, 8, 1, 11, 4, 2, 14, 17, 3, 14, 13, 8, 19, 14, 5, 5]"
line 25 corpus_12.txt,line 25,corpus_12.txt,200703-071311_yor_7f4_elicit_24.wav,"Bó bá di dandan kóo gbé àkàbà gba kọ̀rọ̀ kọjá , kí o mọ̀ pé àwọn èèyàn ò ní mọ̀ pé o ń bọ̀ lọ́nà . ## If you have to move the ladder around a corner , be aware that others will not be expecting this .","[1, 33, 1, 27, 3, 8, 3, 0, 13, 3, 0, 13, 10, 33, 14, 6, 1, 29, 26, 10, 26, 1, 26, 6, 1, 0, 10, 41, 17, 41, 10, 41, 9, 27, 10, 31, 14, 12, 41, 15, 29, 26, 22, 41, 13, 28, 28, 24, 26, 13, 32, 13, 31, 12, 41, 15, 29, 14, 36, 1, 41, 11, 41, 13, 26, 8, 5, 24, 14, 20, 7, 0, 21, 4, 19, 14, 12, 14, 21, 4, 19, 7, 4, 11, 0, 3, 3, 4, 17, 0, 17, 14, 20, 13, 3, 0, 2, 14, 17, 13, 4, 17, 1, 4, 0, 22, 0, 17, 4, 19, 7, 0, 19, 14, 19, 7, 4, 17, 18, 22, 8, 11, 11, 13, 14, 19, 1, 4, 4, 23, 15, 4, 2, 19, 8, 13, 6, 19, 7, 8, 18]"
line 26 corpus_12.txt,line 26,corpus_12.txt,200703-071311_yor_7f4_elicit_25.wav,"Fẹ̀lẹ̀ ké àgò o , kí o sì rí i pé ọ̀nà là . ## Shout a friendly warning , and check to see if the way is clear .","[5, 40, 11, 40, 10, 29, 26, 6, 32, 14, 10, 31, 14, 18, 30, 17, 31, 8, 15, 29, 41, 13, 26, 11, 26, 18, 7, 14, 20, 19, 0, 5, 17, 8, 4, 13, 3, 11, 24, 22, 0, 17, 13, 8, 13, 6, 0, 13, 3, 2, 7, 4, 2, 10, 19, 14, 18, 4, 4, 8, 5, 19, 7, 4, 22, 0, 24, 8, 18, 2, 11, 4, 0, 17]"
line 27 corpus_12.txt,line 27,corpus_12.txt,200703-071311_yor_7f4_elicit_26.wav,"Tóo bá gbé irinṣẹ́ dání lórí àkàbà , rántí pé irinṣẹ́ ìde - nǹkan kólíẹ́ pàápàá lè ṣèèyàn léṣe tó bá já bọ́ luni látòkè . ## When you have tools with you on a ladder , remember that even a small screwdriver can cause injury when dropped from a height .","[19, 33, 14, 1, 27, 6, 1, 29, 8, 17, 8, 13, 39, 40, 3, 27, 13, 31, 11, 33, 17, 31, 26, 10, 26, 1, 26, 17, 27, 13, 19, 31, 15, 29, 8, 17, 8, 13, 39, 40, 30, 3, 4, 13, 37, 10, 0, 13, 10, 33, 11, 31, 40, 15, 26, 27, 15, 26, 27, 11, 28, 39, 28, 28, 24, 26, 13, 11, 29, 39, 4, 19, 33, 1, 27, 9, 27, 1, 41, 11, 20, 13, 8, 11, 27, 19, 32, 10, 28, 22, 7, 4, 13, 24, 14, 20, 7, 0, 21, 4, 19, 14, 14, 11, 18, 22, 8, 19, 7, 24, 14, 20, 14, 13, 0, 11, 0, 3, 3, 4, 17, 17, 4, 12, 4, 12, 1, 4, 17, 19, 7, 0, 19, 4, 21, 4, 13, 0, 18, 12, 0, 11, 11, 18, 2, 17, 4, 22, 3, 17, 8, 21, 4, 17, 2, 0, 13, 2, 0, 20, 18, 4, 8, 13, 9, 20, 17, 24, 22, 7, 4, 13, 3, 17, 14, 15, 15, 4, 3, 5, 17, 14, 12, 0, 7, 4, 8, 6, 7, 19]"
line 28 corpus_12.txt,line 28,corpus_12.txt,200703-071311_yor_7f4_elicit_27.wav,"Bóo bá fẹ́ fibẹ̀ sílẹ̀ fún ìdí kan , tí o ò sì de àkàbà mọ́ nǹkan kan , wá ẹni tí yóò bá ẹ dúró tì í , tàbí kóo rọra gbé àkàbà náà kalẹ̀ dìgbà tóo máa padà dé . ## If you have to go away for some reason and you have been unable to tie the ladder securely , get someone to stand guard , or lay the ladder down safely until you return .","[1, 33, 14, 1, 27, 5, 40, 5, 8, 1, 40, 18, 31, 11, 40, 5, 35, 13, 30, 3, 31, 10, 0, 13, 19, 31, 14, 32, 18, 30, 3, 4, 26, 10, 26, 1, 26, 12, 41, 13, 37, 10, 0, 13, 10, 0, 13, 22, 27, 40, 13, 8, 19, 31, 24, 33, 32, 1, 27, 40, 3, 35, 17, 33, 19, 30, 31, 19, 26, 1, 31, 10, 33, 14, 17, 41, 17, 0, 6, 1, 29, 26, 10, 26, 1, 26, 13, 27, 26, 10, 0, 11, 40, 3, 30, 6, 1, 26, 19, 33, 14, 12, 27, 0, 15, 0, 3, 26, 3, 29, 8, 5, 24, 14, 20, 7, 0, 21, 4, 19, 14, 6, 14, 0, 22, 0, 24, 5, 14, 17, 18, 14, 12, 4, 17, 4, 0, 18, 14, 13, 0, 13, 3, 24, 14, 20, 7, 0, 21, 4, 1, 4, 4, 13, 20, 13, 0, 1, 11, 4, 19, 14, 19, 8, 4, 19, 7, 4, 11, 0, 3, 3, 4, 17, 18, 4, 2, 20, 17, 4, 11, 24, 6, 4, 19, 18, 14, 12, 4, 14, 13, 4, 19, 14, 18, 19, 0, 13, 3, 6, 20, 0, 17, 3, 14, 17, 11, 0, 24, 19, 7, 4, 11, 0, 3, 3, 4, 17, 3, 14, 22, 13, 18, 0, 5, 4, 11, 24, 20, 13, 19, 8, 11, 24, 14, 20, 17, 4, 19, 20, 17, 13]"
line 29 corpus_12.txt,line 29,corpus_12.txt,200703-071311_yor_7f4_elicit_28.wav,Má kàn fi í sílẹ̀ bẹ́ẹ̀ . ## Do not leave it unattended .,"[12, 27, 10, 26, 13, 5, 8, 31, 18, 31, 11, 40, 1, 40, 40, 3, 14, 13, 14, 19, 11, 4, 0, 21, 4, 8, 19, 20, 13, 0, 19, 19, 4, 13, 3, 4, 3]"
line 30 corpus_12.txt,line 30,corpus_12.txt,200703-071311_yor_7f4_elicit_29.wav,9 Rí i pé ara rẹ le . ## 9 Check your state of health .,"[17, 31, 8, 15, 29, 0, 17, 0, 17, 40, 11, 4, 2, 7, 4, 2, 10, 24, 14, 20, 17, 18, 19, 0, 19, 4, 14, 5, 7, 4, 0, 11, 19, 7]"
line 31 corpus_12.txt,line 31,corpus_12.txt,200703-071311_yor_7f4_elicit_30.wav,"Níwọ̀n bí gígun nǹkan ti jẹ́ ọ̀ràn kí ara èèyàn balẹ̀ , kí ó sì máa gbésẹ̀ ní ṣísẹ̀ - n - tẹ̀lé , má ṣe gun nǹkan kan bí ara rẹ ò bá yá tàbí bí èébì bá ń gbé ẹ tàbí bí òòyì bá ń kọ́ ẹ . ## Since climbing is largely a matter of balance and rhythm , do not climb if you feel sick or nauseated or if you suffer from vertigo .","[13, 31, 22, 41, 13, 1, 31, 6, 31, 6, 20, 13, 13, 37, 10, 0, 13, 19, 8, 9, 40, 41, 17, 26, 13, 10, 31, 0, 17, 0, 28, 28, 24, 26, 13, 1, 0, 11, 40, 10, 31, 33, 18, 30, 12, 27, 0, 6, 1, 29, 18, 40, 13, 31, 39, 31, 18, 40, 13, 19, 40, 11, 29, 12, 27, 39, 4, 6, 20, 13, 13, 37, 10, 0, 13, 10, 0, 13, 1, 31, 0, 17, 0, 17, 40, 32, 1, 27, 24, 27, 19, 26, 1, 31, 1, 31, 28, 29, 1, 30, 1, 27, 36, 6, 1, 29, 40, 19, 26, 1, 31, 1, 31, 32, 32, 24, 30, 1, 27, 36, 10, 41, 40, 18, 8, 13, 2, 4, 2, 11, 8, 12, 1, 8, 13, 6, 8, 18, 11, 0, 17, 6, 4, 11, 24, 0, 12, 0, 19, 19, 4, 17, 14, 5, 1, 0, 11, 0, 13, 2, 4, 0, 13, 3, 17, 7, 24, 19, 7, 12, 3, 14, 13, 14, 19, 2, 11, 8, 12, 1, 8, 5, 24, 14, 20, 5, 4, 4, 11, 18, 8, 2, 10, 14, 17, 13, 0, 20, 18, 4, 0, 19, 4, 3, 14, 17, 8, 5, 24, 14, 20, 18, 20, 5, 5, 4, 17, 5, 17, 14, 12, 21, 4, 17, 19, 8, 6, 14]"
line 32 corpus_12.txt,line 32,corpus_12.txt,200703-071311_yor_7f4_elicit_31.wav,10 Má fọ̀ràn ààbò ṣeré o . ## 10 Climb safely .,"[12, 27, 5, 41, 17, 26, 13, 26, 26, 1, 32, 39, 4, 17, 29, 14, 2, 11, 8, 12, 1, 18, 0, 5, 4, 11, 24]"
line 33 corpus_12.txt,line 33,corpus_12.txt,200703-071311_yor_7f4_elicit_32.wav,"Gbogbo ìgbà ni kí ọ̀ràn ààbò máa jẹ ẹ́ lógún . ## At all times , be safety conscious .","[6, 1, 14, 6, 1, 14, 30, 6, 1, 26, 13, 8, 10, 31, 41, 17, 26, 13, 26, 26, 1, 32, 12, 27, 0, 9, 40, 40, 11, 33, 6, 35, 13, 0, 19, 0, 11, 11, 19, 8, 12, 4, 18, 1, 4, 18, 0, 5, 4, 19, 24, 2, 14, 13, 18, 2, 8, 14, 20, 18]"
line 34 corpus_12.txt,line 34,corpus_12.txt,200703-071311_yor_7f4_elicit_33.wav,Èèyàn méjì tàbí jù bẹ́ẹ̀ lọ ò gbọ́dọ̀ wà lórí àkàbà lẹ́ẹ̀kan náà . ## Never allow two or more people on a ladder at the same time .,"[28, 28, 24, 26, 13, 12, 29, 9, 30, 19, 26, 1, 31, 9, 34, 1, 40, 40, 11, 41, 32, 6, 1, 41, 3, 41, 22, 26, 11, 33, 17, 31, 26, 10, 26, 1, 26, 11, 40, 40, 10, 0, 13, 13, 27, 26, 13, 4, 21, 4, 17, 0, 11, 11, 14, 22, 19, 22, 14, 14, 17, 12, 14, 17, 4, 15, 4, 14, 15, 11, 4, 14, 13, 0, 11, 0, 3, 3, 4, 17, 0, 19, 19, 7, 4, 18, 0, 12, 4, 19, 8, 12, 4]"
line 35 corpus_12.txt,line 35,corpus_12.txt,200703-071311_yor_7f4_elicit_34.wav,"O ò gbọ́dọ̀ gùn ún nígbà tí ìjì líle ń jà . ## Never climb in strong , blustery winds .","[14, 32, 6, 1, 41, 3, 41, 6, 34, 13, 35, 13, 13, 31, 6, 1, 26, 19, 31, 30, 9, 30, 11, 31, 11, 4, 36, 9, 26, 13, 4, 21, 4, 17, 2, 11, 8, 12, 1, 8, 13, 18, 19, 17, 14, 13, 6, 1, 11, 20, 18, 19, 4, 17, 24, 22, 8, 13, 3, 18]"
line 36 corpus_12.txt,line 36,corpus_12.txt,200703-071311_yor_7f4_elicit_35.wav,"Tó bá ṣe pé àkàbà ẹlẹ́sẹ̀ mẹ́rin lo ń lò , o ò gbọ́dọ̀ dúró lé ìdásẹ̀lé òkè pátápátá , tó bá sì jẹ́ pé àkàbà gígùn lò ń lò , o ò gbọ́dọ̀ dúró lé ìdásẹ̀lé mẹ́rin tó kẹ́yìn sókè . ## Never stand on the top rung of a stepladder or above the fourth rung from the top of a long ladder .","[19, 33, 1, 27, 39, 4, 15, 29, 26, 10, 26, 1, 26, 40, 11, 40, 18, 40, 12, 40, 17, 8, 13, 11, 14, 36, 11, 32, 14, 32, 6, 1, 41, 3, 41, 3, 35, 17, 33, 11, 29, 30, 3, 27, 18, 40, 11, 29, 32, 10, 28, 15, 27, 19, 27, 15, 27, 19, 27, 19, 33, 1, 27, 18, 30, 9, 40, 15, 29, 26, 10, 26, 1, 26, 6, 31, 6, 34, 13, 11, 32, 36, 11, 32, 14, 32, 6, 1, 41, 3, 41, 3, 35, 17, 33, 11, 29, 30, 3, 27, 18, 40, 11, 29, 12, 40, 17, 8, 13, 19, 33, 10, 40, 24, 30, 13, 18, 33, 10, 28, 13, 4, 21, 4, 17, 18, 19, 0, 13, 3, 14, 13, 19, 7, 4, 19, 14, 15, 17, 20, 13, 6, 14, 5, 0, 18, 19, 4, 15, 11, 0, 3, 3, 4, 17, 14, 17, 0, 1, 14, 21, 4, 19, 7, 4, 5, 14, 20, 17, 19, 7, 17, 20, 13, 6, 5, 17, 14, 12, 19, 7, 4, 19, 14, 15, 14, 5, 0, 11, 14, 13, 6, 11, 0, 3, 3, 4, 17]"
line 37 corpus_12.txt,line 37,corpus_12.txt,200703-071311_yor_7f4_elicit_36.wav,"Tó bá jẹ́ pé àkàbà tí wọ́n ń kì bọnú ara wọn lò ń lò , o ò gbọ́dọ̀ nà án tán ; ó kéré tán , ó gbọ́dọ̀ ṣẹ́ ku ìdásẹ̀lé mẹ́ta nínú ara wọn . ## Never overextend an extension ladder ; always have at least three rungs overlapping .","[19, 33, 1, 27, 9, 40, 15, 29, 26, 10, 26, 1, 26, 19, 31, 22, 41, 13, 36, 10, 30, 1, 41, 13, 35, 0, 17, 0, 22, 41, 13, 11, 32, 36, 11, 32, 14, 32, 6, 1, 41, 3, 41, 13, 26, 27, 13, 19, 27, 13, 33, 10, 29, 17, 29, 19, 27, 13, 33, 6, 1, 41, 3, 41, 39, 40, 10, 20, 30, 3, 27, 18, 40, 11, 29, 12, 40, 19, 0, 13, 31, 13, 35, 0, 17, 0, 22, 41, 13, 13, 4, 21, 4, 17, 14, 21, 4, 17, 4, 23, 19, 4, 13, 3, 0, 13, 4, 23, 19, 4, 13, 18, 8, 14, 13, 11, 0, 3, 3, 4, 17, 0, 11, 22, 0, 24, 18, 7, 0, 21, 4, 0, 19, 11, 4, 0, 18, 19, 19, 7, 17, 4, 4, 17, 20, 13, 6, 18, 14, 21, 4, 17, 11, 0, 15, 15, 8, 13, 6]"
line 38 corpus_12.txt,line 38,corpus_12.txt,200703-071311_yor_7f4_elicit_37.wav,O ò gbọ́dọ̀ nàgà jù . ## Never reach too far .,"[14, 32, 6, 1, 41, 3, 41, 13, 26, 6, 26, 9, 34, 13, 4, 21, 4, 17, 17, 4, 0, 2, 7, 19, 14, 14, 5, 0, 17]"
line 39 corpus_12.txt,line 39,corpus_12.txt,200703-071311_yor_7f4_elicit_38.wav,"Bóo bá tẹ̀ sẹ́gbẹ̀ẹ́ kan jù lórí àkàbà , ẹsẹ̀ rẹ lè yẹ̀ , wàá sì bára ẹ nílẹ̀ . ## If you lean too far while on a ladder , it is easy to lose your balance and fall .","[1, 33, 14, 1, 27, 19, 40, 18, 40, 6, 1, 40, 40, 10, 0, 13, 9, 34, 11, 33, 17, 31, 26, 10, 26, 1, 26, 40, 18, 40, 17, 40, 11, 28, 24, 40, 22, 26, 27, 18, 30, 1, 27, 17, 0, 40, 13, 31, 11, 40, 8, 5, 24, 14, 20, 11, 4, 0, 13, 19, 14, 14, 5, 0, 17, 22, 7, 8, 11, 4, 14, 13, 0, 11, 0, 3, 3, 4, 17, 8, 19, 8, 18, 4, 0, 18, 24, 19, 14, 11, 14, 18, 4, 24, 14, 20, 17, 1, 0, 11, 0, 13, 2, 4, 0, 13, 3, 5, 0, 11, 11]"
