index,line_nos,transcript_file,audio_file,transcript,tokens
line 1 corpus10.txt,line 1,corpus10.txt,200701-162550_yor_7f4_elicit_0.wav,O ru ládugbó ò ńrerá; kí ni ká sọ fẹ́ni tó ru Òrìṣà-a Yemọja? ## Because you are carrying a huge pot you strut; what would one say to the person carrying the divinity Yemoja?,"[14, 17, 20, 11, 27, 3, 20, 6, 1, 33, 32, 36, 17, 4, 17, 27, 10, 31, 13, 8, 10, 27, 18, 41, 5, 40, 13, 8, 19, 33, 17, 20, 32, 17, 30, 39, 26, 0, 24, 4, 12, 41, 9, 0, 1, 4, 2, 0, 20, 18, 4, 24, 14, 20, 0, 17, 4, 2, 0, 17, 17, 24, 8, 13, 6, 0, 7, 20, 6, 4, 15, 14, 19, 24, 14, 20, 18, 19, 17, 20, 19, 22, 7, 0, 19, 22, 14, 20, 11, 3, 14, 13, 4, 18, 0, 24, 19, 14, 19, 7, 4, 15, 4, 17, 18, 14, 13, 2, 0, 17, 17, 24, 8, 13, 6, 19, 7, 4, 3, 8, 21, 8, 13, 8, 19, 24, 24, 4, 12, 14, 9, 0]"
line 2 corpus10.txt,line 2,corpus10.txt,200701-162550_yor_7f4_elicit_1.wav,"Ó tọ́ kí eégún léni lóko àgbàdo, èwo ni ti Pákọ̀kọ̀ láàrin ìlú? ## It might be seemly for a masquerader to chase one off a corn farm, but it is not seemly for Pákọ̀kọ̀ to chase one in the middle of town.","[33, 19, 41, 10, 31, 4, 29, 6, 35, 13, 11, 29, 13, 8, 11, 33, 10, 14, 26, 6, 1, 26, 3, 14, 28, 22, 14, 13, 8, 19, 8, 15, 27, 10, 41, 10, 41, 11, 27, 26, 17, 8, 13, 30, 11, 35, 8, 19, 12, 8, 6, 7, 19, 1, 4, 18, 4, 4, 12, 11, 24, 5, 14, 17, 0, 12, 0, 18, 16, 20, 4, 17, 0, 3, 4, 17, 19, 14, 2, 7, 0, 18, 4, 14, 13, 4, 14, 5, 5, 0, 2, 14, 17, 13, 5, 0, 17, 12, 1, 20, 19, 8, 19, 8, 18, 13, 14, 19, 18, 4, 4, 12, 11, 24, 5, 14, 17, 15, 27, 10, 41, 10, 41, 19, 14, 2, 7, 0, 18, 4, 14, 13, 4, 8, 13, 19, 7, 4, 12, 8, 3, 3, 11, 4, 14, 5, 19, 14, 22, 13]"
line 3 corpus10.txt,line 3,corpus10.txt,200701-162550_yor_7f4_elicit_2.wav,"Ó yẹ ẹni gbogbo kó sọ pé iṣu ò jiná, kò yẹ alubàtá. ## Everybody has a right to say the yams are not well cooked, but not the bàtá drummer.","[33, 24, 40, 40, 13, 8, 6, 1, 14, 6, 1, 14, 10, 33, 18, 41, 15, 29, 8, 39, 20, 32, 9, 8, 13, 27, 10, 32, 24, 40, 0, 11, 20, 1, 26, 19, 27, 4, 21, 4, 17, 24, 1, 14, 3, 24, 7, 0, 18, 0, 17, 8, 6, 7, 19, 19, 14, 18, 0, 24, 19, 7, 4, 24, 0, 12, 18, 0, 17, 4, 13, 14, 19, 22, 4, 11, 11, 2, 14, 14, 10, 4, 3, 1, 20, 19, 13, 14, 19, 19, 7, 4, 1, 26, 19, 27, 3, 17, 20, 12, 12, 4, 17]"
line 4 corpus10.txt,line 4,corpus10.txt,200701-162550_yor_7f4_elicit_3.wav,"Ó yẹ ẹni gbogbo kó dínwó aró, kò yẹ atọ̀ọ́lé. ## It is fitting for everybody to bargain to reduce the cost of dyeing clothes, but not the bed wetter.","[33, 24, 40, 40, 13, 8, 6, 1, 14, 6, 1, 14, 10, 33, 3, 31, 13, 22, 33, 0, 17, 33, 10, 32, 24, 40, 0, 19, 41, 41, 11, 29, 8, 19, 8, 18, 5, 8, 19, 19, 8, 13, 6, 5, 14, 17, 4, 21, 4, 17, 24, 1, 14, 3, 24, 19, 14, 1, 0, 17, 6, 0, 8, 13, 19, 14, 17, 4, 3, 20, 2, 4, 19, 7, 4, 2, 14, 18, 19, 14, 5, 3, 24, 4, 8, 13, 6, 2, 11, 14, 19, 7, 4, 18, 1, 20, 19, 13, 14, 19, 19, 7, 4, 1, 4, 3, 22, 4, 19, 19, 4, 17]"
line 5 corpus10.txt,line 5,corpus10.txt,200701-162550_yor_7f4_elicit_4.wav,"Ó yẹ ẹni gbogbo kó sọ pé “Ọlọ́run a-ṣèkan-má-kù,” kò yẹ akúkó. ## Everyone can justifiably say, “God, who has left nothing undone,” but not a eunuch.","[33, 24, 40, 40, 13, 8, 6, 1, 14, 6, 1, 14, 10, 33, 18, 41, 15, 29, 41, 11, 41, 17, 20, 13, 0, 39, 28, 10, 0, 13, 12, 27, 10, 34, 10, 32, 24, 40, 0, 10, 35, 10, 33, 4, 21, 4, 17, 24, 14, 13, 4, 2, 0, 13, 9, 20, 18, 19, 8, 5, 8, 0, 1, 11, 24, 18, 0, 24, 6, 14, 3, 22, 7, 14, 7, 0, 18, 11, 4, 5, 19, 13, 14, 19, 7, 8, 13, 6, 20, 13, 3, 14, 13, 4, 1, 20, 19, 13, 14, 19, 0, 4, 20, 13, 20, 2, 7]"
line 6 corpus10.txt,line 6,corpus10.txt,200701-162550_yor_7f4_elicit_5.wav,"Odò kékeré lalákàn-án ti lè fọ́ epo; bó bá di àgàdàm̀gbá tán, odò a gbé alákàn lọ. ## It is only in a small stream that the crab can make its oil; when it becomes huge and swift the river sweeps the crab away.","[14, 3, 32, 10, 29, 10, 4, 17, 29, 11, 0, 11, 27, 10, 26, 13, 27, 13, 19, 8, 11, 28, 5, 41, 4, 15, 14, 1, 33, 1, 27, 3, 8, 26, 6, 26, 3, 26, 12, 6, 1, 27, 19, 27, 13, 14, 3, 32, 0, 6, 1, 29, 0, 11, 27, 10, 26, 13, 11, 41, 8, 19, 8, 18, 14, 13, 11, 24, 8, 13, 0, 18, 12, 0, 11, 11, 18, 19, 17, 4, 0, 12, 19, 7, 0, 19, 19, 7, 4, 2, 17, 0, 1, 2, 0, 13, 12, 0, 10, 4, 8, 19, 18, 14, 8, 11, 22, 7, 4, 13, 8, 19, 1, 4, 2, 14, 12, 4, 18, 7, 20, 6, 4, 0, 13, 3, 18, 22, 8, 5, 19, 19, 7, 4, 17, 8, 21, 4, 17, 18, 22, 4, 4, 15, 18, 19, 7, 4, 2, 17, 0, 1, 0, 22, 0, 24]"
line 7 corpus10.txt,line 7,corpus10.txt,200701-162550_yor_7f4_elicit_6.wav,"Òfin ni yó sọ ara ẹ̀; ìyàwó tí ńna ọmọ ìyálé. ## The law will assert itself, “as in the case of” a junior wife flogging the child of the senior wife.","[32, 5, 8, 13, 13, 8, 24, 33, 18, 41, 0, 17, 0, 40, 30, 24, 26, 22, 33, 19, 31, 36, 13, 0, 41, 12, 41, 30, 24, 27, 11, 29, 19, 7, 4, 11, 0, 22, 22, 8, 11, 11, 0, 18, 18, 4, 17, 19, 8, 19, 18, 4, 11, 5, 0, 18, 8, 13, 19, 7, 4, 2, 0, 18, 4, 14, 5, 0, 9, 20, 13, 8, 14, 17, 22, 8, 5, 4, 5, 11, 14, 6, 6, 8, 13, 6, 19, 7, 4, 2, 7, 8, 11, 3, 14, 5, 19, 7, 4, 18, 4, 13, 8, 14, 17, 22, 8, 5, 4]"
line 8 corpus10.txt,line 8,corpus10.txt,200701-162550_yor_7f4_elicit_7.wav,Ogun tí olójúméjìí rí sá ni olójúkan-án ní òún ńlọ jà. ## The war that the two-eyed person saw and fled is the same the one-eyed person vows he will join.,"[14, 6, 20, 13, 19, 31, 14, 11, 33, 9, 35, 12, 29, 9, 30, 31, 17, 31, 18, 27, 13, 8, 14, 11, 33, 9, 35, 10, 0, 13, 27, 13, 13, 31, 32, 35, 13, 36, 11, 41, 9, 26, 19, 7, 4, 22, 0, 17, 19, 7, 0, 19, 19, 7, 4, 19, 22, 14, 4, 24, 4, 3, 15, 4, 17, 18, 14, 13, 18, 0, 22, 0, 13, 3, 5, 11, 4, 3, 8, 18, 19, 7, 4, 18, 0, 12, 4, 19, 7, 4, 14, 13, 4, 4, 24, 4, 3, 15, 4, 17, 18, 14, 13, 21, 14, 22, 18, 7, 4, 22, 8, 11, 11, 9, 14, 8, 13]"
line 9 corpus10.txt,line 9,corpus10.txt,200701-162550_yor_7f4_elicit_8.wav,"Ohun méjì ló yẹ Ẹ̀ṣọ́: Ẹ̀ṣọ́ jà, ó lé ogun; Ẹ̀ṣọ́ jà ó kú sógun. ## Only two things are proper for a warrior: the warrior goes to war and drives the enemy off; the warrior goes to war and dies in battle.","[14, 7, 20, 13, 12, 29, 9, 30, 11, 33, 24, 40, 40, 39, 41, 40, 39, 41, 9, 26, 33, 11, 29, 14, 6, 20, 13, 40, 39, 41, 9, 26, 33, 10, 35, 18, 33, 6, 20, 13, 14, 13, 11, 24, 19, 22, 14, 19, 7, 8, 13, 6, 18, 0, 17, 4, 15, 17, 14, 15, 4, 17, 5, 14, 17, 0, 22, 0, 17, 17, 8, 14, 17, 19, 7, 4, 22, 0, 17, 17, 8, 14, 17, 6, 14, 4, 18, 19, 14, 22, 0, 17, 0, 13, 3, 3, 17, 8, 21, 4, 18, 19, 7, 4, 4, 13, 4, 12, 24, 14, 5, 5, 19, 7, 4, 22, 0, 17, 17, 8, 14, 17, 6, 14, 4, 18, 19, 14, 22, 0, 17, 0, 13, 3, 3, 8, 4, 18, 8, 13, 1, 0, 19, 19, 11, 4]"
line 10 corpus10.txt,line 10,corpus10.txt,200701-162550_yor_7f4_elicit_9.wav,Ohun tí à ńtà là ńjẹ; kì í ṣe ọ̀rọ̀ oní-kẹrosíìnì. ## What one sells is what one eats; that does not apply to the kerosene seller.,"[14, 7, 20, 13, 19, 31, 26, 36, 19, 26, 11, 26, 36, 9, 40, 10, 30, 31, 39, 4, 41, 17, 41, 14, 13, 31, 10, 40, 17, 14, 18, 31, 30, 13, 30, 22, 7, 0, 19, 14, 13, 4, 18, 4, 11, 11, 18, 8, 18, 22, 7, 0, 19, 14, 13, 4, 4, 0, 19, 18, 19, 7, 0, 19, 3, 14, 4, 18, 13, 14, 19, 0, 15, 15, 11, 24, 19, 14, 19, 7, 4, 10, 4, 17, 14, 18, 4, 13, 4, 18, 4, 11, 11, 4, 17]"
line 11 corpus10.txt,line 11,corpus10.txt,200701-162550_yor_7f4_elicit_10.wav,Ohun tí eèrá bá lè gbé ní ńpè ní ìgànnìkó. ## Whatever the ant is able to carry is what it says is its full measure.,"[14, 7, 20, 13, 19, 31, 4, 28, 17, 27, 1, 27, 11, 28, 6, 1, 29, 13, 31, 36, 15, 28, 13, 31, 30, 6, 26, 13, 13, 30, 10, 33, 22, 7, 0, 19, 4, 21, 4, 17, 19, 7, 4, 0, 13, 19, 8, 18, 0, 1, 11, 4, 19, 14, 2, 0, 17, 17, 24, 8, 18, 22, 7, 0, 19, 8, 19, 18, 0, 24, 18, 8, 18, 8, 19, 18, 5, 20, 11, 11, 12, 4, 0, 18, 20, 17, 4]"
line 12 corpus10.txt,line 12,corpus10.txt,200701-162550_yor_7f4_elicit_11.wav,"Ohun tí ìrẹ̀-ẹ́ ṣe tó fi kán lápá, aláàńtèté ní kí wọ́n jẹ́ kí òun ó ṣe è. ## That which the cricket attempted and broke a thigh, the aláàńtètè asks to be permitted to attempt.","[14, 7, 20, 13, 19, 31, 30, 17, 40, 40, 39, 4, 19, 33, 5, 8, 10, 27, 13, 11, 27, 15, 27, 0, 11, 27, 26, 36, 19, 28, 19, 29, 13, 31, 10, 31, 22, 41, 13, 9, 40, 10, 31, 32, 20, 13, 33, 39, 4, 28, 19, 7, 0, 19, 22, 7, 8, 2, 7, 19, 7, 4, 2, 17, 8, 2, 10, 4, 19, 0, 19, 19, 4, 12, 15, 19, 4, 3, 0, 13, 3, 1, 17, 14, 10, 4, 0, 19, 7, 8, 6, 7, 19, 7, 4, 0, 11, 27, 26, 36, 19, 28, 19, 28, 0, 18, 10, 18, 19, 14, 1, 4, 15, 4, 17, 12, 8, 19, 19, 4, 3, 19, 14, 0, 19, 19, 4, 12, 15, 19]"
line 13 corpus10.txt,line 13,corpus10.txt,200701-162550_yor_7f4_elicit_12.wav,Ohun tí kò tó okòó kì í jẹ àgbà níyà. ## A thing that is not worth the least amount of money should not prove a hardship for an elder.,"[14, 7, 20, 13, 19, 31, 10, 32, 19, 33, 14, 10, 32, 33, 10, 30, 31, 9, 40, 26, 6, 1, 26, 13, 31, 24, 26, 0, 19, 7, 8, 13, 6, 19, 7, 0, 19, 8, 18, 13, 14, 19, 22, 14, 17, 19, 7, 19, 7, 4, 11, 4, 0, 18, 19, 0, 12, 14, 20, 13, 19, 14, 5, 12, 14, 13, 4, 24, 18, 7, 14, 20, 11, 3, 13, 14, 19, 15, 17, 14, 21, 4, 0, 7, 0, 17, 3, 18, 7, 8, 15, 5, 14, 17, 0, 13, 4, 11, 3, 4, 17]"
line 14 corpus10.txt,line 14,corpus10.txt,200701-162550_yor_7f4_elicit_13.wav,"Ohun tí wèré fi ńse ara ẹ̀, ó pọ̀ ju ohun tó fi ńṣẹ ọmọ ẹlòmíràn lọ. ## What the imbecile does to himself is far worse than what he does to others.","[14, 7, 20, 13, 19, 31, 22, 28, 17, 29, 5, 8, 36, 18, 4, 0, 17, 0, 40, 33, 15, 41, 9, 20, 14, 7, 20, 13, 19, 33, 5, 8, 36, 39, 40, 41, 12, 41, 40, 11, 32, 12, 31, 17, 26, 13, 11, 41, 22, 7, 0, 19, 19, 7, 4, 8, 12, 1, 4, 2, 8, 11, 4, 3, 14, 4, 18, 19, 14, 7, 8, 12, 18, 4, 11, 5, 8, 18, 5, 0, 17, 22, 14, 17, 18, 4, 19, 7, 0, 13, 22, 7, 0, 19, 7, 4, 3, 14, 4, 18, 19, 14, 14, 19, 7, 4, 17, 18]"
line 15 corpus10.txt,line 15,corpus10.txt,200701-162550_yor_7f4_elicit_14.wav,"Ohun tó ṣeé faga là ńfaga sí; èwo ni,“Ìwòyí àná mo ti na ànaà mi fága-fàga”? ## One boasts only about things proper to boast about; whoever heard of the boast, “By this time yesterday I had given my parent-in-law the beating of his life.”?","[14, 7, 20, 13, 19, 33, 39, 4, 29, 5, 0, 6, 0, 11, 26, 36, 5, 0, 6, 0, 18, 31, 28, 22, 14, 13, 8, 30, 22, 32, 24, 31, 26, 13, 27, 12, 14, 19, 8, 13, 0, 26, 13, 0, 26, 12, 8, 5, 27, 6, 0, 5, 26, 6, 0, 14, 13, 4, 1, 14, 0, 18, 19, 18, 14, 13, 11, 24, 0, 1, 14, 20, 19, 19, 7, 8, 13, 6, 18, 15, 17, 14, 15, 4, 17, 19, 14, 1, 14, 0, 18, 19, 0, 1, 14, 20, 19, 22, 7, 14, 4, 21, 4, 17, 7, 4, 0, 17, 3, 14, 5, 19, 7, 4, 1, 14, 0, 18, 19, 1, 24, 19, 7, 8, 18, 19, 8, 12, 4, 24, 4, 18, 19, 4, 17, 3, 0, 24, 8, 7, 0, 3, 6, 8, 21, 4, 13, 12, 24, 15, 0, 17, 4, 13, 19, 8, 13, 11, 0, 22, 19, 7, 4, 1, 4, 0, 19, 8, 13, 6, 14, 5, 7, 8, 18, 11, 8, 5, 4]"
line 16 corpus10.txt,line 16,corpus10.txt,200701-162550_yor_7f4_elicit_15.wav,Ojú àlejò la ti ńjẹ gbèsè; ẹ̀hìn-in ẹ̀ là ńsan án. ## It is in a visitor's presence that one gets into debt; it is in her absence that one repays the debt.,"[14, 9, 35, 26, 11, 4, 9, 32, 11, 0, 19, 8, 36, 9, 40, 6, 1, 28, 18, 28, 40, 7, 30, 13, 8, 13, 40, 11, 26, 36, 18, 0, 13, 27, 13, 8, 19, 8, 18, 8, 13, 0, 21, 8, 18, 8, 19, 14, 17, 18, 15, 17, 4, 18, 4, 13, 2, 4, 19, 7, 0, 19, 14, 13, 4, 6, 4, 19, 18, 8, 13, 19, 14, 3, 4, 1, 19, 8, 19, 8, 18, 8, 13, 7, 4, 17, 0, 1, 18, 4, 13, 2, 4, 19, 7, 0, 19, 14, 13, 4, 17, 4, 15, 0, 24, 18, 19, 7, 4, 3, 4, 1, 19]"
line 17 corpus10.txt,line 17,corpus10.txt,200701-162550_yor_7f4_elicit_16.wav,"Ojú baba ara; awọ́n bí ojú; aṣòró dà bí àgbà. ## The eye, father of the body; nothing is as valuable as the eye; nothing is as difficult to achieve as the status of elder.","[14, 9, 35, 1, 0, 1, 0, 0, 17, 0, 0, 22, 41, 13, 1, 31, 14, 9, 35, 0, 39, 32, 17, 33, 3, 26, 1, 31, 26, 6, 1, 26, 19, 7, 4, 4, 24, 4, 5, 0, 19, 7, 4, 17, 14, 5, 19, 7, 4, 1, 14, 3, 24, 13, 14, 19, 7, 8, 13, 6, 8, 18, 0, 18, 21, 0, 11, 20, 0, 1, 11, 4, 0, 18, 19, 7, 4, 4, 24, 4, 13, 14, 19, 7, 8, 13, 6, 8, 18, 0, 18, 3, 8, 5, 5, 8, 2, 20, 11, 19, 19, 14, 0, 2, 7, 8, 4, 21, 4, 0, 18, 19, 7, 4, 18, 19, 0, 19, 20, 18, 14, 5, 4, 11, 3, 4, 17]"
line 18 corpus10.txt,line 18,corpus10.txt,200701-162550_yor_7f4_elicit_17.wav,Ojú iná kọ́ lewùrà ńhurun. ## It is not in the presence of the flame that water-yam grows hair.,"[14, 9, 35, 8, 13, 27, 10, 41, 11, 4, 22, 34, 17, 26, 36, 7, 20, 17, 20, 13, 8, 19, 8, 18, 13, 14, 19, 8, 13, 19, 7, 4, 15, 17, 4, 18, 4, 13, 2, 4, 14, 5, 19, 7, 4, 5, 11, 0, 12, 4, 19, 7, 0, 19, 22, 0, 19, 4, 17, 24, 0, 12, 6, 17, 14, 22, 18, 7, 0, 8, 17]"
line 19 corpus10.txt,line 19,corpus10.txt,200701-162550_yor_7f4_elicit_18.wav,Ojú kì í pọ́n ẹdun kó dẹni ilẹ̀; ìṣẹ́ kì í ṣẹ́ igún kó di ojúgbà adìẹ. ## The colobus monkey is never so reduced in circumstances that it becomes a land-hugging creature; the vulture is never so badly off that it becomes the equal of a chicken.,"[14, 9, 35, 10, 30, 31, 15, 41, 13, 40, 3, 20, 13, 10, 33, 3, 40, 13, 8, 8, 11, 40, 30, 39, 40, 10, 30, 31, 39, 40, 8, 6, 35, 13, 10, 33, 3, 8, 14, 9, 35, 6, 1, 26, 0, 3, 30, 40, 19, 7, 4, 2, 14, 11, 14, 1, 20, 18, 12, 14, 13, 10, 4, 24, 8, 18, 13, 4, 21, 4, 17, 18, 14, 17, 4, 3, 20, 2, 4, 3, 8, 13, 2, 8, 17, 2, 20, 12, 18, 19, 0, 13, 2, 4, 18, 19, 7, 0, 19, 8, 19, 1, 4, 2, 14, 12, 4, 18, 0, 11, 0, 13, 3, 7, 20, 6, 6, 8, 13, 6, 2, 17, 4, 0, 19, 20, 17, 4, 19, 7, 4, 21, 20, 11, 19, 20, 17, 4, 8, 18, 13, 4, 21, 4, 17, 18, 14, 1, 0, 3, 11, 24, 14, 5, 5, 19, 7, 0, 19, 8, 19, 1, 4, 2, 14, 12, 4, 18, 19, 7, 4, 4, 16, 20, 0, 11, 14, 5, 0, 2, 7, 8, 2, 10, 4, 13]"
line 20 corpus10.txt,line 20,corpus10.txt,200701-162550_yor_7f4_elicit_19.wav,Ojú kì í pọ́n baálé ilé kó fọwọ́ gbálẹ̀ ilé ẹ̀. ## A head of a household is never so hard up that he sweeps his compound with his bare hands.,"[14, 9, 35, 10, 30, 31, 15, 41, 13, 1, 0, 27, 11, 29, 8, 11, 29, 10, 33, 5, 41, 22, 41, 6, 1, 27, 11, 40, 8, 11, 29, 40, 0, 7, 4, 0, 3, 14, 5, 0, 7, 14, 20, 18, 4, 7, 14, 11, 3, 8, 18, 13, 4, 21, 4, 17, 18, 14, 7, 0, 17, 3, 20, 15, 19, 7, 0, 19, 7, 4, 18, 22, 4, 4, 15, 18, 7, 8, 18, 2, 14, 12, 15, 14, 20, 13, 3, 22, 8, 19, 7, 7, 8, 18, 1, 0, 17, 4, 7, 0, 13, 3, 18]"
line 21 corpus10.txt,line 21,corpus10.txt,200701-162550_yor_7f4_elicit_20.wav,Ojú kì í pọ́n babaláwo kó bèrè ẹbọ àná. ## An Ifá diviner-priest is never so hard up that he asks for yesterday's sacrifice.,"[14, 9, 35, 10, 30, 31, 15, 41, 13, 1, 0, 1, 0, 11, 27, 22, 14, 10, 33, 1, 28, 17, 28, 40, 1, 41, 26, 13, 27, 0, 13, 8, 5, 27, 3, 8, 21, 8, 13, 4, 17, 15, 17, 8, 4, 18, 19, 8, 18, 13, 4, 21, 4, 17, 18, 14, 7, 0, 17, 3, 20, 15, 19, 7, 0, 19, 7, 4, 0, 18, 10, 18, 5, 14, 17, 24, 4, 18, 19, 4, 17, 3, 0, 24, 18, 18, 0, 2, 17, 8, 5, 8, 2, 4]"
line 22 corpus10.txt,line 22,corpus10.txt,200701-162550_yor_7f4_elicit_21.wav,Ojú kì í pọ́n òkú ọ̀run kó ní kí ará ayé gba òun. ## A dead person cannot be so desperate as to appeal to a living person for deliverance.,"[14, 9, 35, 10, 30, 31, 15, 41, 13, 32, 10, 35, 41, 17, 20, 13, 10, 33, 13, 31, 10, 31, 0, 17, 27, 0, 24, 29, 6, 1, 0, 32, 20, 13, 0, 3, 4, 0, 3, 15, 4, 17, 18, 14, 13, 2, 0, 13, 13, 14, 19, 1, 4, 18, 14, 3, 4, 18, 15, 4, 17, 0, 19, 4, 0, 18, 19, 14, 0, 15, 15, 4, 0, 11, 19, 14, 0, 11, 8, 21, 8, 13, 6, 15, 4, 17, 18, 14, 13, 5, 14, 17, 3, 4, 11, 8, 21, 4, 17, 0, 13, 2, 4]"
line 23 corpus10.txt,line 23,corpus10.txt,200701-162550_yor_7f4_elicit_22.wav,Ojú kì í pọ́nni ká fàbúrò ẹni ṣaya. ## One should not become so desperate that one takes one's younger sister as wife.,"[14, 9, 35, 10, 30, 31, 15, 41, 13, 13, 8, 10, 27, 5, 26, 1, 35, 17, 32, 40, 13, 8, 39, 0, 24, 0, 14, 13, 4, 18, 7, 14, 20, 11, 3, 13, 14, 19, 1, 4, 2, 14, 12, 4, 18, 14, 3, 4, 18, 15, 4, 17, 0, 19, 4, 19, 7, 0, 19, 14, 13, 4, 19, 0, 10, 4, 18, 14, 13, 4, 18, 24, 14, 20, 13, 6, 4, 17, 18, 8, 18, 19, 4, 17, 0, 18, 22, 8, 5, 4]"
line 24 corpus10.txt,line 24,corpus10.txt,200701-162550_yor_7f4_elicit_23.wav,Ojú kì í pọnni ká fàkísà bora. ## One should never be so benighted that one covers oneself in rags.,"[14, 9, 35, 10, 30, 31, 15, 41, 13, 13, 8, 10, 27, 5, 26, 10, 31, 18, 26, 1, 14, 17, 0, 14, 13, 4, 18, 7, 14, 20, 11, 3, 13, 4, 21, 4, 17, 1, 4, 18, 14, 1, 4, 13, 8, 6, 7, 19, 4, 3, 19, 7, 0, 19, 14, 13, 4, 2, 14, 21, 4, 17, 18, 14, 13, 4, 18, 4, 11, 5, 8, 13, 17, 0, 6, 18]"
line 25 corpus10.txt,line 25,corpus10.txt,200701-162550_yor_7f4_elicit_24.wav,Ojú kì í pọ́nni ká pọ́n léhín. ## One's circumstances do not so deteriorate that one becomes red in teeth.,"[14, 9, 35, 10, 30, 31, 15, 41, 13, 13, 8, 10, 27, 15, 41, 13, 11, 29, 7, 31, 13, 14, 13, 4, 18, 2, 8, 17, 2, 20, 12, 18, 19, 0, 13, 2, 4, 18, 3, 14, 13, 14, 19, 18, 14, 3, 4, 19, 4, 17, 8, 14, 17, 0, 19, 4, 19, 7, 0, 19, 14, 13, 4, 1, 4, 2, 14, 12, 4, 18, 17, 4, 3, 8, 13, 19, 4, 4, 19, 7]"
line 26 corpus10.txt,line 26,corpus10.txt,200701-162550_yor_7f4_elicit_25.wav,Ojú ò rọ́lá rí; ó bímọ ẹ̀ ó sọ ọ́ ní Ọláníyọnu. ## A person only newly acquainted with wealth; he has a son and names him Ọlaniyọnu.,"[14, 9, 35, 32, 17, 41, 11, 27, 17, 31, 33, 1, 31, 12, 41, 40, 33, 18, 41, 41, 13, 31, 41, 11, 27, 13, 31, 24, 41, 13, 20, 0, 15, 4, 17, 18, 14, 13, 14, 13, 11, 24, 13, 4, 22, 11, 24, 0, 2, 16, 20, 0, 8, 13, 19, 4, 3, 22, 8, 19, 7, 22, 4, 0, 11, 19, 7, 7, 4, 7, 0, 18, 0, 18, 14, 13, 0, 13, 3, 13, 0, 12, 4, 18, 7, 8, 12, 41, 11, 0, 13, 8, 24, 41, 13, 20]"
line 27 corpus10.txt,line 27,corpus10.txt,200701-162550_yor_7f4_elicit_26.wav,"Ojú ò ti oníṣègùn, ó ní àna òun ńkú lọ. ## The medicine man lacks all shame, he announces that his parent-in-law is dying.","[14, 9, 35, 32, 19, 8, 14, 13, 31, 39, 28, 6, 34, 13, 33, 13, 31, 26, 13, 0, 32, 20, 13, 36, 10, 35, 11, 41, 19, 7, 4, 12, 4, 3, 8, 2, 8, 13, 4, 12, 0, 13, 11, 0, 2, 10, 18, 0, 11, 11, 18, 7, 0, 12, 4, 7, 4, 0, 13, 13, 14, 20, 13, 2, 4, 18, 19, 7, 0, 19, 7, 8, 18, 15, 0, 17, 4, 13, 19, 8, 13, 11, 0, 22, 8, 18, 3, 24, 8, 13, 6]"
line 28 corpus10.txt,line 28,corpus10.txt,200701-162550_yor_7f4_elicit_27.wav,Ojú ti agbọ́ń agbọ́n láfà kò léro. ## Shame upon the wasp; the wasp has a nest but no honey.,"[14, 9, 35, 19, 8, 0, 6, 1, 41, 36, 0, 6, 1, 41, 13, 11, 27, 5, 26, 10, 32, 11, 29, 17, 14, 18, 7, 0, 12, 4, 20, 15, 14, 13, 19, 7, 4, 22, 0, 18, 15, 19, 7, 4, 22, 0, 18, 15, 7, 0, 18, 0, 13, 4, 18, 19, 1, 20, 19, 13, 14, 7, 14, 13, 4, 24]"
line 29 corpus10.txt,line 29,corpus10.txt,200701-162550_yor_7f4_elicit_28.wav,"Òkété pẹ̀lú ọmọ ẹ̀-ẹ́ di ọgbọọgba sínú ihò; nígba tí ìyá ńfehín pàkùrọ́, ọmọ náà ńfehín pa pẹ̀lú. ## The giant bush rat and its child become equals in their hole; the mother cracks palm-nuts with its teeth, and the child does the same thing.","[32, 10, 29, 19, 29, 15, 40, 11, 35, 41, 12, 41, 40, 40, 3, 8, 41, 6, 1, 41, 41, 6, 1, 0, 18, 31, 13, 35, 8, 7, 32, 13, 31, 6, 1, 0, 19, 31, 30, 24, 27, 36, 5, 4, 7, 31, 13, 15, 26, 10, 34, 17, 41, 41, 12, 41, 13, 27, 26, 36, 5, 4, 7, 31, 13, 15, 0, 15, 40, 11, 35, 19, 7, 4, 6, 8, 0, 13, 19, 1, 20, 18, 7, 17, 0, 19, 0, 13, 3, 8, 19, 18, 2, 7, 8, 11, 3, 1, 4, 2, 14, 12, 4, 4, 16, 20, 0, 11, 18, 8, 13, 19, 7, 4, 8, 17, 7, 14, 11, 4, 19, 7, 4, 12, 14, 19, 7, 4, 17, 2, 17, 0, 2, 10, 18, 15, 0, 11, 12, 13, 20, 19, 18, 22, 8, 19, 7, 8, 19, 18, 19, 4, 4, 19, 7, 0, 13, 3, 19, 7, 4, 2, 7, 8, 11, 3, 3, 14, 4, 18, 19, 7, 4, 18, 0, 12, 4, 19, 7, 8, 13, 6]"
line 30 corpus10.txt,line 30,corpus10.txt,200701-162550_yor_7f4_elicit_29.wav,Òkùnkùn ò mẹni ọ̀wọ̀; ó dÍfá fún “Ìwọ́ tá nìyẹn”? ## Darkness does not know who deserves deference; it consulted the oracle Ifá for “Who might you be?”,"[32, 10, 34, 13, 10, 34, 13, 32, 12, 40, 13, 8, 41, 22, 41, 33, 3, 31, 5, 27, 5, 35, 13, 30, 22, 41, 19, 27, 13, 30, 24, 40, 13, 3, 0, 17, 10, 13, 4, 18, 18, 3, 14, 4, 18, 13, 14, 19, 10, 13, 14, 22, 22, 7, 14, 3, 4, 18, 4, 17, 21, 4, 18, 3, 4, 5, 4, 17, 4, 13, 2, 4, 8, 19, 2, 14, 13, 18, 20, 11, 19, 4, 3, 19, 7, 4, 14, 17, 0, 2, 11, 4, 8, 5, 27, 5, 14, 17, 22, 7, 14, 12, 8, 6, 7, 19, 24, 14, 20, 1, 4]"
line 31 corpus10.txt,line 31,corpus10.txt,200701-162550_yor_7f4_elicit_30.wav,Olóbìnrin kan kì í pagbo ìja. ## A person who has only one wife does not form a circle for a fight.,"[14, 11, 33, 1, 30, 13, 17, 8, 13, 10, 0, 13, 10, 30, 31, 15, 0, 6, 1, 14, 30, 9, 0, 0, 15, 4, 17, 18, 14, 13, 22, 7, 14, 7, 0, 18, 14, 13, 11, 24, 14, 13, 4, 22, 8, 5, 4, 3, 14, 4, 18, 13, 14, 19, 5, 14, 17, 12, 0, 2, 8, 17, 2, 11, 4, 5, 14, 17, 0, 5, 8, 6, 7, 19]"
line 32 corpus10.txt,line 32,corpus10.txt,200701-162550_yor_7f4_elicit_31.wav,Olójúkan kì í tàkìtì òró. ## A one-eyed person does not attempt standing somersaults.,"[14, 11, 33, 9, 35, 10, 0, 13, 10, 30, 31, 19, 26, 10, 30, 19, 30, 32, 17, 33, 0, 14, 13, 4, 4, 24, 4, 3, 15, 4, 17, 18, 14, 13, 3, 14, 4, 18, 13, 14, 19, 0, 19, 19, 4, 12, 15, 19, 18, 19, 0, 13, 3, 8, 13, 6, 18, 14, 12, 4, 17, 18, 0, 20, 11, 19, 18]"
line 33 corpus10.txt,line 33,corpus10.txt,200701-162550_yor_7f4_elicit_32.wav,Olómele kì í sọ pé igi yó dàá lóde lọ́la. ## The omele drummer does not vow that there will be an earth-shaking performance on the morrow.,"[14, 11, 33, 12, 4, 11, 4, 10, 30, 31, 18, 41, 15, 29, 8, 6, 8, 24, 33, 3, 26, 27, 11, 33, 3, 4, 11, 41, 11, 0, 19, 7, 4, 14, 12, 4, 11, 4, 3, 17, 20, 12, 12, 4, 17, 3, 14, 4, 18, 13, 14, 19, 21, 14, 22, 19, 7, 0, 19, 19, 7, 4, 17, 4, 22, 8, 11, 11, 1, 4, 0, 13, 4, 0, 17, 19, 7, 18, 7, 0, 10, 8, 13, 6, 15, 4, 17, 5, 14, 17, 12, 0, 13, 2, 4, 14, 13, 19, 7, 4, 12, 14, 17, 17, 14, 22]"
line 34 corpus10.txt,line 34,corpus10.txt,200701-162550_yor_7f4_elicit_33.wav,"Olówó jẹun jẹ́jẹ́; òtòṣì jẹun tìpà-tìjàn; òtòṣì tí ḿbá ọlọ́rọ̀ rìn, akọ ojú ló ńyá. ## The rich man eats slowly and at leisure; the poor person eats fast and with anxiety; the poor man who keeps company with a wealthy man is exceeding his station.","[14, 11, 33, 22, 33, 9, 40, 20, 13, 9, 40, 9, 40, 32, 19, 32, 39, 30, 9, 40, 20, 13, 19, 30, 15, 26, 19, 30, 9, 26, 13, 32, 19, 32, 39, 30, 19, 31, 38, 1, 27, 41, 11, 41, 17, 41, 17, 30, 13, 0, 10, 41, 14, 9, 35, 11, 33, 36, 24, 27, 19, 7, 4, 17, 8, 2, 7, 12, 0, 13, 4, 0, 19, 18, 18, 11, 14, 22, 11, 24, 0, 13, 3, 0, 19, 11, 4, 8, 18, 20, 17, 4, 19, 7, 4, 15, 14, 14, 17, 15, 4, 17, 18, 14, 13, 4, 0, 19, 18, 5, 0, 18, 19, 0, 13, 3, 22, 8, 19, 7, 0, 13, 23, 8, 4, 19, 24, 19, 7, 4, 15, 14, 14, 17, 12, 0, 13, 22, 7, 14, 10, 4, 4, 15, 18, 2, 14, 12, 15, 0, 13, 24, 22, 8, 19, 7, 0, 22, 4, 0, 11, 19, 7, 24, 12, 0, 13, 8, 18, 4, 23, 2, 4, 4, 3, 8, 13, 6, 7, 8, 18, 18, 19, 0, 19, 8, 14, 13]"
line 35 corpus10.txt,line 35,corpus10.txt,200701-162550_yor_7f4_elicit_34.wav,Olówó ní ḿbá ọlọ́rọ̀-ọ́ rìn; ẹgbẹ́ ní ḿbá ẹgbẹ́ ṣeré. ## It is a rich person that keeps company with a wealthy person; only people of equal standing play together.,"[14, 11, 33, 22, 33, 13, 31, 38, 1, 27, 41, 11, 41, 17, 41, 41, 17, 30, 13, 40, 6, 1, 40, 13, 31, 38, 1, 27, 40, 6, 1, 40, 39, 4, 17, 29, 8, 19, 8, 18, 0, 17, 8, 2, 7, 15, 4, 17, 18, 14, 13, 19, 7, 0, 19, 10, 4, 4, 15, 18, 2, 14, 12, 15, 0, 13, 24, 22, 8, 19, 7, 0, 22, 4, 0, 11, 19, 7, 24, 15, 4, 17, 18, 14, 13, 14, 13, 11, 24, 15, 4, 14, 15, 11, 4, 14, 5, 4, 16, 20, 0, 11, 18, 19, 0, 13, 3, 8, 13, 6, 15, 11, 0, 24, 19, 14, 6, 4, 19, 7, 4, 17]"
line 36 corpus10.txt,line 36,corpus10.txt,200701-162550_yor_7f4_elicit_35.wav,Olówó ní ńjẹ iyán ẹgbàá. ## It is a rich person that eats pounded yams worth two thousand cowries.,"[14, 11, 33, 22, 33, 13, 31, 36, 9, 40, 8, 24, 27, 13, 40, 6, 1, 26, 27, 8, 19, 8, 18, 0, 17, 8, 2, 7, 15, 4, 17, 18, 14, 13, 19, 7, 0, 19, 4, 0, 19, 18, 15, 14, 20, 13, 3, 4, 3, 24, 0, 12, 18, 22, 14, 17, 19, 7, 19, 22, 14, 19, 7, 14, 20, 18, 0, 13, 3, 2, 14, 22, 17, 8, 4, 18]"
line 37 corpus10.txt,line 37,corpus10.txt,200701-162550_yor_7f4_elicit_36.wav,Olóyè kékeré kì í ṣe fáàárí níwájú ọba. ## A minor chief should not act garrulously in the presence of a king.,"[14, 11, 33, 24, 28, 10, 29, 10, 4, 17, 29, 10, 30, 31, 39, 4, 5, 27, 26, 27, 17, 31, 13, 31, 22, 27, 9, 35, 41, 1, 0, 0, 12, 8, 13, 14, 17, 2, 7, 8, 4, 5, 18, 7, 14, 20, 11, 3, 13, 14, 19, 0, 2, 19, 6, 0, 17, 17, 20, 11, 14, 20, 18, 11, 24, 8, 13, 19, 7, 4, 15, 17, 4, 18, 4, 13, 2, 4, 14, 5, 0, 10, 8, 13, 6]"
line 38 corpus10.txt,line 38,corpus10.txt,200701-162550_yor_7f4_elicit_37.wav,"Òní, ẹtú jìnfìn, ọ̀la, ẹtú jìnfìn; ẹtu nìkan lẹran tó wà nígbó? ## Today, the antelope falls into the ditch; tomorrow, the antelope falls into the ditch; is the antelope the only animal in the forest?","[32, 13, 31, 40, 19, 35, 9, 30, 13, 5, 30, 13, 41, 11, 0, 40, 19, 35, 9, 30, 13, 5, 30, 13, 40, 19, 20, 13, 30, 10, 0, 13, 11, 40, 17, 0, 13, 19, 33, 22, 26, 13, 31, 6, 1, 33, 19, 14, 3, 0, 24, 19, 7, 4, 0, 13, 19, 4, 11, 14, 15, 4, 5, 0, 11, 11, 18, 8, 13, 19, 14, 19, 7, 4, 3, 8, 19, 2, 7, 19, 14, 12, 14, 17, 17, 14, 22, 19, 7, 4, 0, 13, 19, 4, 11, 14, 15, 4, 5, 0, 11, 11, 18, 8, 13, 19, 14, 19, 7, 4, 3, 8, 19, 2, 7, 8, 18, 19, 7, 4, 0, 13, 19, 4, 11, 14, 15, 4, 19, 7, 4, 14, 13, 11, 24, 0, 13, 8, 12, 0, 11, 8, 13, 19, 7, 4, 5, 14, 17, 4, 18, 19]"
