index,line_nos,transcript_file,audio_file,transcript,tokens
line 18 corpus_15.txt,line 18,corpus_15.txt,200703-104537_yor_7f4_elicit_17.wav,Mọ kúlẹ̀kúlẹ̀ nípa àwọn tó jí ọ gbé . ## Learn details about your kidnappers .,"[12, 41, 10, 35, 11, 40, 10, 35, 11, 40, 13, 31, 15, 0, 26, 22, 41, 13, 19, 33, 9, 31, 41, 6, 1, 29, 11, 4, 0, 17, 13, 3, 4, 19, 0, 8, 11, 18, 0, 1, 14, 20, 19, 24, 14, 20, 17, 10, 8, 3, 13, 0, 15, 15, 4, 17, 18]"
line 19 corpus_15.txt,line 19,corpus_15.txt,200703-104537_yor_7f4_elicit_18.wav,"• Tó bá ṣeé ṣe , fọ̀rọ̀ wérọ̀ pẹ̀lú wọn , kí o sì gbìyànjú láti bá wọn jíròrò . ## • Engage in small talk if possible and try to establish contact .","[19, 33, 1, 27, 39, 4, 29, 39, 4, 5, 41, 17, 41, 22, 29, 17, 41, 15, 40, 11, 35, 22, 41, 13, 10, 31, 14, 18, 30, 6, 1, 30, 24, 26, 13, 9, 35, 11, 27, 19, 8, 1, 27, 22, 41, 13, 9, 31, 17, 32, 17, 32, 4, 13, 6, 0, 6, 4, 8, 13, 18, 12, 0, 11, 11, 19, 0, 11, 10, 8, 5, 15, 14, 18, 18, 8, 1, 11, 4, 0, 13, 3, 19, 17, 24, 19, 14, 4, 18, 19, 0, 1, 11, 8, 18, 7, 2, 14, 13, 19, 0, 2, 19]"
line 20 corpus_15.txt,line 20,corpus_15.txt,200703-104537_yor_7f4_elicit_19.wav,"Bí àwọn ajínigbé náà bá wò ẹ́ gẹ́gẹ́ bí èèyàn ẹlẹgbẹ́ wọn , wọ́n lè má ṣe ẹ́ léṣe tàbí kí wọ́n pa ọ́ . ## If the kidnappers see you as an individual , they will be less likely to harm or kill you .","[1, 31, 26, 22, 41, 13, 0, 9, 31, 13, 8, 6, 1, 29, 13, 27, 26, 1, 27, 22, 32, 40, 6, 40, 6, 40, 1, 31, 28, 28, 24, 26, 13, 40, 11, 40, 6, 1, 40, 22, 41, 13, 22, 41, 13, 11, 28, 12, 27, 39, 4, 40, 11, 29, 39, 4, 19, 26, 1, 31, 10, 31, 22, 41, 13, 15, 0, 41, 8, 5, 19, 7, 4, 10, 8, 3, 13, 0, 15, 15, 4, 17, 18, 18, 4, 4, 24, 14, 20, 0, 18, 0, 13, 8, 13, 3, 8, 21, 8, 3, 20, 0, 11, 19, 7, 4, 24, 22, 8, 11, 11, 1, 4, 11, 4, 18, 18, 11, 8, 10, 4, 11, 24, 19, 14, 7, 0, 17, 12, 14, 17, 10, 8, 11, 11, 24, 14, 20]"
line 21 corpus_15.txt,line 21,corpus_15.txt,200703-104537_yor_7f4_elicit_20.wav,• Hùwà bí ọmọlúwàbí tí o bá fẹ́ béèrè ohun tí o nílò lọ́wọ́ wọn . ## • Make them aware of your needs in a polite manner .,"[7, 34, 22, 26, 1, 31, 41, 12, 41, 11, 35, 22, 26, 1, 31, 19, 31, 14, 1, 27, 5, 40, 1, 29, 28, 17, 28, 14, 7, 20, 13, 19, 31, 14, 13, 31, 11, 32, 11, 41, 22, 41, 22, 41, 13, 12, 0, 10, 4, 19, 7, 4, 12, 0, 22, 0, 17, 4, 14, 5, 24, 14, 20, 17, 13, 4, 4, 3, 18, 8, 13, 0, 15, 14, 11, 8, 19, 4, 12, 0, 13, 13, 4, 17]"
line 22 corpus_15.txt,line 22,corpus_15.txt,200703-104537_yor_7f4_elicit_21.wav,• Má ṣe gbìyànjú láti dúnàádúrà ìtúsílẹ̀ ara rẹ . ## • Never try to negotiate your own ransom .,"[12, 27, 39, 4, 6, 1, 30, 24, 26, 13, 9, 35, 11, 27, 19, 8, 3, 35, 13, 26, 27, 3, 35, 17, 26, 30, 19, 35, 18, 31, 11, 40, 0, 17, 0, 17, 40, 13, 4, 21, 4, 17, 19, 17, 24, 19, 14, 13, 4, 6, 14, 19, 8, 0, 19, 4, 24, 14, 20, 17, 14, 22, 13, 17, 0, 13, 18, 14, 12]"
line 23 corpus_15.txt,line 23,corpus_15.txt,200703-104537_yor_7f4_elicit_22.wav,"• Bó bá ṣẹlẹ̀ pé wọ́n fẹ́ wá fipá gbà yín sílẹ̀ , ńṣe ni kí o dọ̀bálẹ̀ láìmira kí o sì máa retí ohun tí yóò ṣẹlẹ̀ . ## • If you find yourself in the middle of a rescue attempt , drop to the floor and wait passively as events unfold .","[1, 33, 1, 27, 39, 40, 11, 40, 15, 29, 22, 41, 13, 5, 40, 22, 27, 5, 8, 15, 27, 6, 1, 26, 24, 31, 13, 18, 31, 11, 40, 36, 39, 4, 13, 8, 10, 31, 14, 3, 41, 1, 27, 11, 40, 11, 27, 30, 12, 8, 17, 0, 10, 31, 14, 18, 30, 12, 27, 0, 17, 4, 19, 31, 14, 7, 20, 13, 19, 31, 24, 33, 32, 39, 40, 11, 40, 8, 5, 24, 14, 20, 5, 8, 13, 3, 24, 14, 20, 17, 18, 4, 11, 5, 8, 13, 19, 7, 4, 12, 8, 3, 3, 11, 4, 14, 5, 0, 17, 4, 18, 2, 20, 4, 0, 19, 19, 4, 12, 15, 19, 3, 17, 14, 15, 19, 14, 19, 7, 4, 5, 11, 14, 14, 17, 0, 13, 3, 22, 0, 8, 19, 15, 0, 18, 18, 8, 21, 4, 11, 24, 0, 18, 4, 21, 4, 13, 19, 18, 20, 13, 5, 14, 11, 3]"
line 24 corpus_15.txt,line 24,corpus_15.txt,200703-104537_yor_7f4_elicit_23.wav,[ Àpótí tó wà ní ojú ìwé 16 ] ## [ Box on page 6 ],"[26, 15, 33, 19, 31, 19, 33, 22, 26, 13, 31, 14, 9, 35, 30, 22, 29, 1, 14, 23, 14, 13, 15, 0, 6, 4]"
line 25 corpus_15.txt,line 25,corpus_15.txt,200703-104537_yor_7f4_elicit_24.wav,Ìbánigbófò Ìjínigbé — Ọ̀ràn Tó Ń Fa Àríyànjiyàn ## Kidnap Insurance — A Controversial Issue,"[30, 1, 27, 13, 8, 6, 1, 33, 5, 32, 30, 9, 31, 13, 8, 6, 1, 29, 41, 17, 26, 13, 19, 33, 36, 5, 0, 26, 17, 31, 24, 26, 13, 9, 8, 24, 26, 13, 10, 8, 3, 13, 0, 15, 8, 13, 18, 20, 17, 0, 13, 2, 4, 0, 2, 14, 13, 19, 17, 14, 21, 4, 17, 18, 8, 0, 11, 8, 18, 18, 20, 4]"
line 26 corpus_15.txt,line 26,corpus_15.txt,200703-104537_yor_7f4_elicit_25.wav,Ilé iṣẹ́ tó tún ń rí ṣe nídìí ọ̀ràn jíjí èèyàn gbé tó ń gbilẹ̀ sí i ni ilé iṣẹ́ ìbánigbófò . ## A boom industry connected with the increase in kidnappings is insurance .,"[8, 11, 29, 8, 39, 40, 19, 33, 19, 35, 13, 36, 17, 31, 39, 4, 13, 31, 3, 30, 31, 41, 17, 26, 13, 9, 31, 9, 31, 28, 28, 24, 26, 13, 6, 1, 29, 19, 33, 36, 6, 1, 8, 11, 40, 18, 31, 8, 13, 8, 8, 11, 29, 8, 39, 40, 30, 1, 27, 13, 8, 6, 1, 33, 5, 32, 0, 1, 14, 14, 12, 8, 13, 3, 20, 18, 19, 17, 24, 2, 14, 13, 13, 4, 2, 19, 4, 3, 22, 8, 19, 7, 19, 7, 4, 8, 13, 2, 17, 4, 0, 18, 4, 8, 13, 10, 8, 3, 13, 0, 15, 15, 8, 13, 6, 18, 8, 18, 8, 13, 18, 20, 17, 0, 13, 2, 4]"
line 27 corpus_15.txt,line 27,corpus_15.txt,200703-104537_yor_7f4_elicit_26.wav,Owó tó ń wọlé fún ilé iṣẹ́ Lloyd’s of London lórí ọ̀ràn ìbánigbófò ìjínigbé lọ́dọọdún ti fi ìpín àádọ́ta nínú ọgọ́rùn - ún pọ̀ sí i láàárín ọdún 1990 sí 1999 . ## Lloyd’s of London has had a 50 percent yearly increase in kidnap insurance during the 1990 ’ s .,"[14, 22, 33, 19, 33, 36, 22, 41, 11, 29, 5, 35, 13, 8, 11, 29, 8, 39, 40, 11, 11, 14, 24, 3, 18, 14, 5, 11, 14, 13, 3, 14, 13, 11, 33, 17, 31, 41, 17, 26, 13, 30, 1, 27, 13, 8, 6, 1, 33, 5, 32, 30, 9, 31, 13, 8, 6, 1, 29, 11, 41, 3, 41, 41, 3, 35, 13, 19, 8, 5, 8, 30, 15, 31, 13, 26, 27, 3, 41, 19, 0, 13, 31, 13, 35, 41, 6, 41, 17, 34, 13, 35, 13, 15, 41, 18, 31, 8, 11, 27, 26, 27, 17, 31, 13, 41, 3, 35, 13, 18, 31, 11, 11, 14, 24, 3, 18, 14, 5, 11, 14, 13, 3, 14, 13, 7, 0, 18, 7, 0, 3, 0, 15, 4, 17, 2, 4, 13, 19, 24, 4, 0, 17, 11, 24, 8, 13, 2, 17, 4, 0, 18, 4, 8, 13, 10, 8, 3, 13, 0, 15, 8, 13, 18, 20, 17, 0, 13, 2, 4, 3, 20, 17, 8, 13, 6, 19, 7, 4, 18]"
line 28 corpus_15.txt,line 28,corpus_15.txt,200703-104537_yor_7f4_elicit_27.wav,Àwọn ilé iṣẹ́ púpọ̀ sí i ló ń fi irú ìbánigbófò yẹn lọni . ## More and more companies are offering such insurance .,"[26, 22, 41, 13, 8, 11, 29, 8, 39, 40, 15, 35, 15, 41, 18, 31, 8, 11, 33, 36, 5, 8, 8, 17, 35, 30, 1, 27, 13, 8, 6, 1, 33, 5, 32, 24, 40, 13, 11, 41, 13, 8, 12, 14, 17, 4, 0, 13, 3, 12, 14, 17, 4, 2, 14, 12, 15, 0, 13, 8, 4, 18, 0, 17, 4, 14, 5, 5, 4, 17, 8, 13, 6, 18, 20, 2, 7, 8, 13, 18, 20, 17, 0, 13, 2, 4]"
line 29 corpus_15.txt,line 29,corpus_15.txt,200703-104537_yor_7f4_elicit_28.wav,"Ìbánigbófò náà kan ríran ẹni tó ń dúnàádúrà lọ́wọ́ , sísan owó ìtúsílẹ̀ , àti nígbà mìíràn ìsapá àwọn amọṣẹ́dunjú láti gba owó ìtúsílẹ̀ náà padà . ## The insurance covers the assistance of a kidnap negotiator , payment of a ransom , and sometimes professional efforts to get the ransom back .","[30, 1, 27, 13, 8, 6, 1, 33, 5, 32, 13, 27, 26, 10, 0, 13, 17, 31, 17, 0, 13, 40, 13, 8, 19, 33, 36, 3, 35, 13, 26, 27, 3, 35, 17, 26, 11, 41, 22, 41, 18, 31, 18, 0, 13, 14, 22, 33, 30, 19, 35, 18, 31, 11, 40, 26, 19, 8, 13, 31, 6, 1, 26, 12, 30, 31, 17, 26, 13, 30, 18, 0, 15, 27, 26, 22, 41, 13, 0, 12, 41, 39, 40, 3, 20, 13, 9, 35, 11, 27, 19, 8, 6, 1, 0, 14, 22, 33, 30, 19, 35, 18, 31, 11, 40, 13, 27, 26, 15, 0, 3, 26, 19, 7, 4, 8, 13, 18, 20, 17, 0, 13, 2, 4, 2, 14, 21, 4, 17, 18, 19, 7, 4, 0, 18, 18, 8, 18, 19, 0, 13, 2, 4, 14, 5, 0, 10, 8, 3, 13, 0, 15, 13, 4, 6, 14, 19, 8, 0, 19, 14, 17, 15, 0, 24, 12, 4, 13, 19, 14, 5, 0, 17, 0, 13, 18, 14, 12, 0, 13, 3, 18, 14, 12, 4, 19, 8, 12, 4, 18, 15, 17, 14, 5, 4, 18, 18, 8, 14, 13, 0, 11, 4, 5, 5, 14, 17, 19, 18, 19, 14, 6, 4, 19, 19, 7, 4, 17, 0, 13, 18, 14, 12, 1, 0, 2, 10]"
line 30 corpus_15.txt,line 30,corpus_15.txt,200703-104537_yor_7f4_elicit_29.wav,"Bó tilẹ̀ rí bẹ́ẹ̀ , ọ̀ràn ti ìbánigbófò yìí ń fa awuyewuye gan - an . ## However , the insurance issue is very controversial .","[1, 33, 19, 8, 11, 40, 17, 31, 1, 40, 40, 41, 17, 26, 13, 19, 8, 30, 1, 27, 13, 8, 6, 1, 33, 5, 32, 24, 30, 31, 36, 5, 0, 0, 22, 20, 24, 4, 22, 20, 24, 4, 6, 0, 13, 0, 13, 7, 14, 22, 4, 21, 4, 17, 19, 7, 4, 8, 13, 18, 20, 17, 0, 13, 2, 4, 8, 18, 18, 20, 4, 8, 18, 21, 4, 17, 24, 2, 14, 13, 19, 17, 14, 21, 4, 17, 18, 8, 0, 11]"
line 31 corpus_15.txt,line 31,corpus_15.txt,200703-104537_yor_7f4_elicit_30.wav,Àwọn tí kò nífẹ̀ẹ́ sí òwò ìbánigbófò ìjínigbé ń sọ pé ó ń sọ ìwà ọ̀daràn náà di òwò ńlá ni àti pé kò bójú mu kí èèyàn máa fi ọ̀ràn ìjínigbé pawó . ## Opposers to kidnap insurance claim that it commercializes the crime and that it is immoral to make money off kidnapping .,"[26, 22, 41, 13, 19, 31, 10, 32, 13, 31, 5, 40, 40, 18, 31, 32, 22, 32, 30, 1, 27, 13, 8, 6, 1, 33, 5, 32, 30, 9, 31, 13, 8, 6, 1, 29, 36, 18, 41, 15, 29, 33, 36, 18, 41, 30, 22, 26, 41, 3, 0, 17, 26, 13, 13, 27, 26, 3, 8, 32, 22, 32, 36, 11, 27, 13, 8, 26, 19, 8, 15, 29, 10, 32, 1, 33, 9, 35, 12, 20, 10, 31, 28, 28, 24, 26, 13, 12, 27, 0, 5, 8, 41, 17, 26, 13, 30, 9, 31, 13, 8, 6, 1, 29, 15, 0, 22, 33, 14, 15, 15, 14, 18, 4, 17, 18, 19, 14, 10, 8, 3, 13, 0, 15, 8, 13, 18, 20, 17, 0, 13, 2, 4, 2, 11, 0, 8, 12, 19, 7, 0, 19, 8, 19, 2, 14, 12, 12, 4, 17, 2, 8, 0, 11, 8, 25, 4, 18, 19, 7, 4, 2, 17, 8, 12, 4, 0, 13, 3, 19, 7, 0, 19, 8, 19, 8, 18, 8, 12, 12, 14, 17, 0, 11, 19, 14, 12, 0, 10, 4, 12, 14, 13, 4, 24, 14, 5, 5, 10, 8, 3, 13, 0, 15, 15, 8, 13, 6]"
line 32 corpus_15.txt,line 32,corpus_15.txt,200703-104537_yor_7f4_elicit_31.wav,"Wọ́n tún sọ pé ẹni tí wọ́n ń bá gbófò lè wá jọ̀gọ̀ nù kó máà mú ọ̀ràn ààbò rẹ̀ lógìírí mọ́ àti pé ìbánigbófò á túbọ̀ mú kí iṣẹ́ bíbéèrè tí àwọn ajínigbé ń béèrè owó máa rọrùn sí i ni , ìyẹn á sì jẹ́ kí ìwà ọ̀daràn yìí máa pọ̀ sí i . ## They also say that an insured person might be careless about his own security and that the insurance will facilitate the kidnappers ’ task of extorting money , thus encouraging this criminal activity .","[22, 41, 13, 19, 35, 13, 18, 41, 15, 29, 40, 13, 8, 19, 31, 22, 41, 13, 36, 1, 27, 6, 1, 33, 5, 32, 11, 28, 22, 27, 9, 41, 6, 41, 13, 34, 10, 33, 12, 27, 26, 12, 35, 41, 17, 26, 13, 26, 26, 1, 32, 17, 40, 11, 33, 6, 30, 31, 17, 31, 12, 41, 26, 19, 8, 15, 29, 30, 1, 27, 13, 8, 6, 1, 33, 5, 32, 27, 19, 35, 1, 41, 12, 35, 10, 31, 8, 39, 40, 1, 31, 1, 29, 28, 17, 28, 19, 31, 26, 22, 41, 13, 0, 9, 31, 13, 8, 6, 1, 29, 36, 1, 29, 28, 17, 28, 14, 22, 33, 12, 27, 0, 17, 41, 17, 34, 13, 18, 31, 8, 13, 8, 30, 24, 40, 13, 27, 18, 30, 9, 40, 10, 31, 30, 22, 26, 41, 3, 0, 17, 26, 13, 24, 30, 31, 12, 27, 0, 15, 41, 18, 31, 8, 19, 7, 4, 24, 0, 11, 18, 14, 18, 0, 24, 19, 7, 0, 19, 0, 13, 8, 13, 18, 20, 17, 4, 3, 15, 4, 17, 18, 14, 13, 12, 8, 6, 7, 19, 1, 4, 2, 0, 17, 4, 11, 4, 18, 18, 0, 1, 14, 20, 19, 7, 8, 18, 14, 22, 13, 18, 4, 2, 20, 17, 8, 19, 24, 0, 13, 3, 19, 7, 0, 19, 19, 7, 4, 8, 13, 18, 20, 17, 0, 13, 2, 4, 22, 8, 11, 11, 5, 0, 2, 8, 11, 8, 19, 0, 19, 4, 19, 7, 4, 10, 8, 3, 13, 0, 15, 15, 4, 17, 18, 19, 0, 18, 10, 14, 5, 4, 23, 19, 14, 17, 19, 8, 13, 6, 12, 14, 13, 4, 24, 19, 7, 20, 18, 4, 13, 2, 14, 20, 17, 0, 6, 8, 13, 6, 19, 7, 8, 18, 2, 17, 8, 12, 8, 13, 0, 11, 0, 2, 19, 8, 21, 8, 19, 24]"
line 33 corpus_15.txt,line 33,corpus_15.txt,200703-104537_yor_7f4_elicit_32.wav,"Àwọn kan tilẹ̀ ń bẹ̀rù pé bí ọ̀ràn ìbánigbófò bá wà , èyí lè mú kí àwọn èèyàn máa ṣètò pé kí a jí àwọn gbé kí àwọn lè rí owó ìbánigbófò gbà . ## Some even fear that the availability of insurance will encourage people to arrange their own kidnapping to get the insurance money .","[26, 22, 41, 13, 10, 0, 13, 19, 8, 11, 40, 36, 1, 40, 17, 34, 15, 29, 1, 31, 41, 17, 26, 13, 30, 1, 27, 13, 8, 6, 1, 33, 5, 32, 1, 27, 22, 26, 28, 24, 31, 11, 28, 12, 35, 10, 31, 26, 22, 41, 13, 28, 28, 24, 26, 13, 12, 27, 0, 39, 28, 19, 32, 15, 29, 10, 31, 0, 9, 31, 26, 22, 41, 13, 6, 1, 29, 10, 31, 26, 22, 41, 13, 11, 28, 17, 31, 14, 22, 33, 30, 1, 27, 13, 8, 6, 1, 33, 5, 32, 6, 1, 26, 18, 14, 12, 4, 4, 21, 4, 13, 5, 4, 0, 17, 19, 7, 0, 19, 19, 7, 4, 0, 21, 0, 8, 11, 0, 1, 8, 11, 8, 19, 24, 14, 5, 8, 13, 18, 20, 17, 0, 13, 2, 4, 22, 8, 11, 11, 4, 13, 2, 14, 20, 17, 0, 6, 4, 15, 4, 14, 15, 11, 4, 19, 14, 0, 17, 17, 0, 13, 6, 4, 19, 7, 4, 8, 17, 14, 22, 13, 10, 8, 3, 13, 0, 15, 15, 8, 13, 6, 19, 14, 6, 4, 19, 19, 7, 4, 8, 13, 18, 20, 17, 0, 13, 2, 4, 12, 14, 13, 4, 24]"
line 34 corpus_15.txt,line 34,corpus_15.txt,200703-104537_yor_7f4_elicit_33.wav,"Wọ́n fòfin de ìbánigbófò ìjínigbé ní Ítálì , Jámánì , àti Kòlóńbíà . ## Kidnap insurance is outlawed in Colombia and Italy .","[22, 41, 13, 5, 32, 5, 8, 13, 3, 4, 30, 1, 27, 13, 8, 6, 1, 33, 5, 32, 30, 9, 31, 13, 8, 6, 1, 29, 13, 31, 31, 19, 27, 11, 30, 9, 27, 12, 27, 13, 30, 26, 19, 8, 10, 32, 11, 33, 36, 1, 31, 26, 10, 8, 3, 13, 0, 15, 8, 13, 18, 20, 17, 0, 13, 2, 4, 8, 18, 14, 20, 19, 11, 0, 22, 4, 3, 8, 13, 2, 14, 11, 14, 12, 1, 8, 0, 0, 13, 3, 8, 19, 0, 11, 24]"
line 35 corpus_15.txt,line 35,corpus_15.txt,200703-104537_yor_7f4_elicit_34.wav,"Àwọn tí wọ́n nífẹ̀ẹ́ sí òwò ìbánigbófò ìjínigbé sọ pé ó ń jẹ́ kí ọ̀pọ̀ èèyàn san owó fún àdánù àwọn èèyàn kéréje bó ṣe rí ní ti àwọn ìbánigbófò mìíràn . ## Supporters of kidnap insurance point out that like any other insurance , it makes many pay for the losses of a few .","[26, 22, 41, 13, 19, 31, 22, 41, 13, 13, 31, 5, 40, 40, 18, 31, 32, 22, 32, 30, 1, 27, 13, 8, 6, 1, 33, 5, 32, 30, 9, 31, 13, 8, 6, 1, 29, 18, 41, 15, 29, 33, 36, 9, 40, 10, 31, 41, 15, 41, 28, 28, 24, 26, 13, 18, 0, 13, 14, 22, 33, 5, 35, 13, 26, 3, 27, 13, 34, 26, 22, 41, 13, 28, 28, 24, 26, 13, 10, 29, 17, 29, 9, 4, 1, 33, 39, 4, 17, 31, 13, 31, 19, 8, 26, 22, 41, 13, 30, 1, 27, 13, 8, 6, 1, 33, 5, 32, 12, 30, 31, 17, 26, 13, 18, 20, 15, 15, 14, 17, 19, 4, 17, 18, 14, 5, 10, 8, 3, 13, 0, 15, 8, 13, 18, 20, 17, 0, 13, 2, 4, 15, 14, 8, 13, 19, 14, 20, 19, 19, 7, 0, 19, 11, 8, 10, 4, 0, 13, 24, 14, 19, 7, 4, 17, 8, 13, 18, 20, 17, 0, 13, 2, 4, 8, 19, 12, 0, 10, 4, 18, 12, 0, 13, 24, 15, 0, 24, 5, 14, 17, 19, 7, 4, 11, 14, 18, 18, 4, 18, 14, 5, 0, 5, 4, 22]"
line 36 corpus_15.txt,line 36,corpus_15.txt,200703-104537_yor_7f4_elicit_35.wav,"Wọ́n ronú pé ìbánigbófò ń fọkàn èèyàn balẹ̀ dé àyè kan , níwọ̀n bí ó ti ń mú kí àwọn ìdílé àti ilé iṣẹ́ tí a mú wọnú ìṣètò náà lè sanwó fún ìrànlọ́wọ́ àwọn amọṣẹ́dunjú tó tóótun , tí wọ́n lè fọkàn ẹni balẹ̀ , tí wọ́n lè dúnàádúrà owó ìtúsílẹ̀ tí kò pọ̀ , tí wọ́n sì lè mú kó rọrùn láti gbá àwọn ajínigbé náà mú . ## They reason that insurance creates a measure of security , since it enables insured families and companies to afford the help of qualified professionals , who can ease tension , negotiate lower ransoms , and make it easier to catch the kidnappers .","[22, 41, 13, 17, 14, 13, 35, 15, 29, 30, 1, 27, 13, 8, 6, 1, 33, 5, 32, 36, 5, 41, 10, 26, 13, 28, 28, 24, 26, 13, 1, 0, 11, 40, 3, 29, 26, 24, 28, 10, 0, 13, 13, 31, 22, 41, 13, 1, 31, 33, 19, 8, 36, 12, 35, 10, 31, 26, 22, 41, 13, 30, 3, 31, 11, 29, 26, 19, 8, 8, 11, 29, 8, 39, 40, 19, 31, 0, 12, 35, 22, 41, 13, 35, 30, 39, 28, 19, 32, 13, 27, 26, 11, 28, 18, 0, 13, 22, 33, 5, 35, 13, 30, 17, 26, 13, 11, 41, 22, 41, 26, 22, 41, 13, 0, 12, 41, 39, 40, 3, 20, 13, 9, 35, 19, 33, 19, 33, 33, 19, 20, 13, 19, 31, 22, 41, 13, 11, 28, 5, 41, 10, 26, 13, 40, 13, 8, 1, 0, 11, 40, 19, 31, 22, 41, 13, 11, 28, 3, 35, 13, 26, 27, 3, 35, 17, 26, 14, 22, 33, 30, 19, 35, 18, 31, 11, 40, 19, 31, 10, 32, 15, 41, 19, 31, 22, 41, 13, 18, 30, 11, 28, 12, 35, 10, 33, 17, 41, 17, 34, 13, 11, 27, 19, 8, 6, 1, 27, 26, 22, 41, 13, 0, 9, 31, 13, 8, 6, 1, 29, 13, 27, 26, 12, 35, 19, 7, 4, 24, 17, 4, 0, 18, 14, 13, 19, 7, 0, 19, 8, 13, 18, 20, 17, 0, 13, 2, 4, 2, 17, 4, 0, 19, 4, 18, 0, 12, 4, 0, 18, 20, 17, 4, 14, 5, 18, 4, 2, 20, 17, 8, 19, 24, 18, 8, 13, 2, 4, 8, 19, 4, 13, 0, 1, 11, 4, 18, 8, 13, 18, 20, 17, 4, 3, 5, 0, 12, 8, 11, 8, 4, 18, 0, 13, 3, 2, 14, 12, 15, 0, 13, 8, 4, 18, 19, 14, 0, 5, 5, 14, 17, 3, 19, 7, 4, 7, 4, 11, 15, 14, 5, 16, 20, 0, 11, 8, 5, 8, 4, 3, 15, 17, 14, 5, 4, 18, 18, 8, 14, 13, 0, 11, 18, 22, 7, 14, 2, 0, 13, 4, 0, 18, 4, 19, 4, 13, 18, 8, 14, 13, 13, 4, 6, 14, 19, 8, 0, 19, 4, 11, 14, 22, 4, 17, 17, 0, 13, 18, 14, 12, 18, 0, 13, 3, 12, 0, 10, 4, 8, 19, 4, 0, 18, 8, 4, 17, 19, 14, 2, 0, 19, 2, 7, 19, 7, 4, 10, 8, 3, 13, 0, 15, 15, 4, 17, 18]"
line 37 corpus_15.txt,line 37,corpus_15.txt,200703-104537_yor_7f4_elicit_36.wav,[ Àpótí tó wà ní ojú ìwé 17 ] ## [ Box on page 7 ],"[26, 15, 33, 19, 31, 19, 33, 22, 26, 13, 31, 14, 9, 35, 30, 22, 29, 1, 14, 23, 14, 13, 15, 0, 6, 4]"
line 38 corpus_15.txt,line 38,corpus_15.txt,200703-104537_yor_7f4_elicit_37.wav,Rúkèrúdò ní Stockholm ## The Stockholm Syndrome,"[17, 35, 10, 28, 17, 35, 3, 32, 13, 31, 18, 19, 14, 2, 10, 7, 14, 11, 12, 19, 7, 4, 18, 19, 14, 2, 10, 7, 14, 11, 12, 18, 24, 13, 3, 17, 14, 12, 4]"
line 39 corpus_15.txt,line 39,corpus_15.txt,200703-104537_yor_7f4_elicit_38.wav,"Lọ́dún 1974 , wọ́n jí Patty Hearst gbé , ọmọ bàbá olówó tórúkọ rẹ̀ ń jẹ́ Randolph A . ## In 1974 the kidnapping of Patty Hearst , daughter of the newspaper billionaire Randolph A .","[11, 41, 3, 35, 13, 22, 41, 13, 9, 31, 15, 0, 19, 19, 24, 7, 4, 0, 17, 18, 19, 6, 1, 29, 41, 12, 41, 1, 26, 1, 27, 14, 11, 33, 22, 33, 19, 33, 17, 35, 10, 41, 17, 40, 36, 9, 40, 17, 0, 13, 3, 14, 11, 15, 7, 0, 8, 13, 19, 7, 4, 10, 8, 3, 13, 0, 15, 15, 8, 13, 6, 14, 5, 15, 0, 19, 19, 24, 7, 4, 0, 17, 18, 19, 3, 0, 20, 6, 7, 19, 4, 17, 14, 5, 19, 7, 4, 13, 4, 22, 18, 15, 0, 15, 4, 17, 1, 8, 11, 11, 8, 14, 13, 0, 8, 17, 4, 17, 0, 13, 3, 14, 11, 15, 7, 0]"
line 40 corpus_15.txt,line 40,corpus_15.txt,200703-104537_yor_7f4_elicit_39.wav,"Hearst , tó ni iléeṣẹ́ ìwé ìròyìn kan , àmọ́ ọ̀rọ̀ bẹ́yìn yọ nígbà tí ọmọbìnrin náà wá gbè sẹ́yìn àwọn tó jí i gbé , tó sì bá ẹgbẹ́ náà lọ digun jalè . ## Hearst , took a surprising turn when she sided with her kidnappers and took part in armed robbery with the group .","[7, 4, 0, 17, 18, 19, 19, 33, 13, 8, 8, 11, 29, 4, 39, 40, 30, 22, 29, 30, 17, 32, 24, 30, 13, 10, 0, 13, 26, 12, 41, 41, 17, 41, 1, 40, 24, 30, 13, 24, 41, 13, 31, 6, 1, 26, 19, 31, 41, 12, 41, 1, 30, 13, 17, 8, 13, 13, 27, 26, 22, 27, 6, 1, 28, 18, 40, 24, 30, 13, 26, 22, 41, 13, 19, 33, 9, 31, 8, 6, 1, 29, 19, 33, 18, 30, 1, 27, 40, 6, 1, 40, 13, 27, 26, 11, 41, 3, 8, 6, 20, 13, 9, 0, 11, 28, 7, 4, 0, 17, 18, 19, 19, 14, 14, 10, 0, 18, 20, 17, 15, 17, 8, 18, 8, 13, 6, 19, 20, 17, 13, 22, 7, 4, 13, 18, 7, 4, 18, 8, 3, 4, 3, 22, 8, 19, 7, 7, 4, 17, 10, 8, 3, 13, 0, 15, 15, 4, 17, 18, 0, 13, 3, 19, 14, 14, 10, 15, 0, 17, 19, 8, 13, 0, 17, 12, 4, 3, 17, 14, 1, 1, 4, 17, 24, 22, 8, 19, 7, 19, 7, 4, 6, 17, 14, 20, 15]"
line 41 corpus_15.txt,line 41,corpus_15.txt,200703-104537_yor_7f4_elicit_40.wav,"Nínú ìṣẹ̀lẹ̀ mìíràn , agbábọ́ọ̀lù kan tó jẹ́ ọmọ ilẹ̀ Sípéènì dárí ji àwọn tó jí i gbé , ó sì ṣàdúrà fún wọn pé wọ́n á ṣoríire . ## In another case a kidnapped Spanish football player forgave his kidnappers and wished them well .","[13, 31, 13, 35, 30, 39, 40, 11, 40, 12, 30, 31, 17, 26, 13, 0, 6, 1, 27, 1, 41, 41, 11, 34, 10, 0, 13, 19, 33, 9, 40, 41, 12, 41, 8, 11, 40, 18, 31, 15, 29, 28, 13, 30, 3, 27, 17, 31, 9, 8, 26, 22, 41, 13, 19, 33, 9, 31, 8, 6, 1, 29, 33, 18, 30, 39, 26, 3, 35, 17, 26, 5, 35, 13, 22, 41, 13, 15, 29, 22, 41, 13, 27, 39, 14, 17, 31, 8, 17, 4, 8, 13, 0, 13, 14, 19, 7, 4, 17, 2, 0, 18, 4, 0, 10, 8, 3, 13, 0, 15, 15, 4, 3, 18, 15, 0, 13, 8, 18, 7, 5, 14, 14, 19, 1, 0, 11, 11, 15, 11, 0, 24, 4, 17, 5, 14, 17, 6, 0, 21, 4, 7, 8, 18, 10, 8, 3, 13, 0, 15, 15, 4, 17, 18, 0, 13, 3, 22, 8, 18, 7, 4, 3, 19, 7, 4, 12, 22, 4, 11, 11]"
line 42 corpus_15.txt,line 42,corpus_15.txt,200703-104537_yor_7f4_elicit_41.wav,"Láàárín ọdún 1970 sí 1974 , orúkọ tí wọ́n pe ìṣẹ̀lẹ̀ mérìíyìírí yìí ni Rúkèrúdò ní Stockholm , ìdí tí wọ́n fi pè é bẹ́ẹ̀ ni jíjí tí wọ́n jí àwọn èèyàn gbé ní ọdún 1973 ní báńkì kan ní Stockholm , Sweden . ## In the early 1970 ’ s , this phenomenon was named the Stockholm Syndrome , after a 1973 hostage drama at a bank in Stockholm , Sweden .","[11, 27, 26, 27, 17, 31, 13, 41, 3, 35, 13, 18, 31, 14, 17, 35, 10, 41, 19, 31, 22, 41, 13, 15, 4, 30, 39, 40, 11, 40, 12, 29, 17, 30, 31, 24, 30, 31, 17, 31, 24, 30, 31, 13, 8, 17, 35, 10, 28, 17, 35, 3, 32, 13, 31, 18, 19, 14, 2, 10, 7, 14, 11, 12, 30, 3, 31, 19, 31, 22, 41, 13, 5, 8, 15, 28, 29, 1, 40, 40, 13, 8, 9, 31, 9, 31, 19, 31, 22, 41, 13, 9, 31, 26, 22, 41, 13, 28, 28, 24, 26, 13, 6, 1, 29, 13, 31, 41, 3, 35, 13, 13, 31, 1, 27, 36, 10, 30, 10, 0, 13, 13, 31, 18, 19, 14, 2, 10, 7, 14, 11, 12, 18, 22, 4, 3, 4, 13, 8, 13, 19, 7, 4, 4, 0, 17, 11, 24, 18, 19, 7, 8, 18, 15, 7, 4, 13, 14, 12, 4, 13, 14, 13, 22, 0, 18, 13, 0, 12, 4, 3, 19, 7, 4, 18, 19, 14, 2, 10, 7, 14, 11, 12, 18, 24, 13, 3, 17, 14, 12, 4, 0, 5, 19, 4, 17, 0, 7, 14, 18, 19, 0, 6, 4, 3, 17, 0, 12, 0, 0, 19, 0, 1, 0, 13, 10, 8, 13, 18, 19, 14, 2, 10, 7, 14, 11, 12, 18, 22, 4, 3, 4, 13]"
line 43 corpus_15.txt,line 43,corpus_15.txt,200703-104537_yor_7f4_elicit_42.wav,"Nígbà yẹn , àwọn kan lára àwọn tí wọ́n jí gbé náà wá di ọ̀rẹ́ àwọn tó jí wọn gbé . ## On that occasion some of the hostages developed a particular friendship with their captors .","[13, 31, 6, 1, 26, 24, 40, 13, 26, 22, 41, 13, 10, 0, 13, 11, 27, 17, 0, 26, 22, 41, 13, 19, 31, 22, 41, 13, 9, 31, 6, 1, 29, 13, 27, 26, 22, 27, 3, 8, 41, 17, 40, 26, 22, 41, 13, 19, 33, 9, 31, 22, 41, 13, 6, 1, 29, 14, 13, 19, 7, 0, 19, 14, 2, 2, 0, 18, 8, 14, 13, 18, 14, 12, 4, 14, 5, 19, 7, 4, 7, 14, 18, 19, 0, 6, 4, 18, 3, 4, 21, 4, 11, 14, 15, 4, 3, 0, 15, 0, 17, 19, 8, 2, 20, 11, 0, 17, 5, 17, 8, 4, 13, 3, 18, 7, 8, 15, 22, 8, 19, 7, 19, 7, 4, 8, 17, 2, 0, 15, 19, 14, 17, 18]"
line 44 corpus_15.txt,line 44,corpus_15.txt,200703-104537_yor_7f4_elicit_43.wav,"Irú àjọṣe yẹn wá jẹ́ ààbò fún àwọn tí wọ́n ń jí gbé , gẹ́gẹ́ bí ìwé Criminal Behavior ṣe ṣàlàyé pé : “ Bí àwọn tí a jí gbé àti àwọn tó jí wọn gbé bá ṣe wá mọ ara wọn dáadáa sí ni wọ́n á ṣe máa fẹ́ràn ara wọn sí i . ## Such interaction has served as a protection to the kidnapped , as the book Criminal Behavior explains : “ The more the victim and the captor get to know one another , the more they tend to like one another .","[8, 17, 35, 26, 9, 41, 39, 4, 24, 40, 13, 22, 27, 9, 40, 26, 26, 1, 32, 5, 35, 13, 26, 22, 41, 13, 19, 31, 22, 41, 13, 36, 9, 31, 6, 1, 29, 6, 40, 6, 40, 1, 31, 30, 22, 29, 2, 17, 8, 12, 8, 13, 0, 11, 1, 4, 7, 0, 21, 8, 14, 17, 39, 4, 39, 26, 11, 26, 24, 29, 15, 29, 1, 31, 26, 22, 41, 13, 19, 31, 0, 9, 31, 6, 1, 29, 26, 19, 8, 26, 22, 41, 13, 19, 33, 9, 31, 22, 41, 13, 6, 1, 29, 1, 27, 39, 4, 22, 27, 12, 41, 0, 17, 0, 22, 41, 13, 3, 27, 0, 3, 27, 0, 18, 31, 13, 8, 22, 41, 13, 27, 39, 4, 12, 27, 0, 5, 40, 17, 26, 13, 0, 17, 0, 22, 41, 13, 18, 31, 8, 18, 20, 2, 7, 8, 13, 19, 4, 17, 0, 2, 19, 8, 14, 13, 7, 0, 18, 18, 4, 17, 21, 4, 3, 0, 18, 0, 15, 17, 14, 19, 4, 2, 19, 8, 14, 13, 19, 14, 19, 7, 4, 10, 8, 3, 13, 0, 15, 15, 4, 3, 0, 18, 19, 7, 4, 1, 14, 14, 10, 2, 17, 8, 12, 8, 13, 0, 11, 1, 4, 7, 0, 21, 8, 14, 17, 4, 23, 15, 11, 0, 8, 13, 18, 19, 7, 4, 12, 14, 17, 4, 19, 7, 4, 21, 8, 2, 19, 8, 12, 0, 13, 3, 19, 7, 4, 2, 0, 15, 19, 14, 17, 6, 4, 19, 19, 14, 10, 13, 14, 22, 14, 13, 4, 0, 13, 14, 19, 7, 4, 17, 19, 7, 4, 12, 14, 17, 4, 19, 7, 4, 24, 19, 4, 13, 3, 19, 14, 11, 8, 10, 4, 14, 13, 4, 0, 13, 14, 19, 7, 4, 17]"
line 45 corpus_15.txt,line 45,corpus_15.txt,200703-104537_yor_7f4_elicit_44.wav,"Ìṣẹ̀lẹ̀ yìí wá fi hàn pé lẹ́yìn ìgbà díẹ̀ , kò jọ pé ọ̀daràn náà máa ṣe ẹni tó jí gbé ní jàǹbá . ” ## This phenomenon indicates that after a period of time the offender is less likely to harm the hostage . ”","[30, 39, 40, 11, 40, 24, 30, 31, 22, 27, 5, 8, 7, 26, 13, 15, 29, 11, 40, 24, 30, 13, 30, 6, 1, 26, 3, 31, 40, 10, 32, 9, 41, 15, 29, 41, 3, 0, 17, 26, 13, 13, 27, 26, 12, 27, 0, 39, 4, 40, 13, 8, 19, 33, 9, 31, 6, 1, 29, 13, 31, 9, 26, 37, 1, 27, 19, 7, 8, 18, 15, 7, 4, 13, 14, 12, 4, 13, 14, 13, 8, 13, 3, 8, 2, 0, 19, 4, 18, 19, 7, 0, 19, 0, 5, 19, 4, 17, 0, 15, 4, 17, 8, 14, 3, 14, 5, 19, 8, 12, 4, 19, 7, 4, 14, 5, 5, 4, 13, 3, 4, 17, 8, 18, 11, 4, 18, 18, 11, 8, 10, 4, 11, 24, 19, 14, 7, 0, 17, 12, 19, 7, 4, 7, 14, 18, 19, 0, 6, 4]"
